job_id,title,location,description,benefits,fraudulent
99,IC&E Technician,"US, , Stocton, CA","IC&amp;E Technician | Bakersfield, CA Mt. PosoPrincipal Duties and Responsibilities: Calibrates, tests, maintains, troubleshoots, and installs all power plant instrumentation, control systems and electrical equipment.Performs maintenance on motor control centers, motor operated valves, generators, excitation equipment and motors.Performs preventive, predictive and corrective maintenance on equipment, coordinating work with various team members.Designs and installs new equipment and/or system modifications.Troubleshoots and performs maintenance on DC backup power equipment, process controls, programmable logic controls (PLC), and emission monitoring equipment.Uses maintenance reporting system to record time and material use, problem identified and corrected, and further action required; provides complete history of maintenance on equipment.Schedule, coordinate, work with and monitor contractors on specific tasks, as required.Follows safe working practices at all times.Identifies safety hazards and recommends solutions.Follows environmental compliance work practices.Identifies environmental non-compliance problems and assist in implementing solutions.Assists other team members and works with all departments to support generating station in achieving their performance goals.Trains other team members in the areas of instrumentation, control, and electrical systems.Performs housekeeping assignments, as directed.Conduct equipment and system tagging according to company and plant rules and regulations.Perform equipment safety inspections, as required, and record results as appropriate. Participate in small construction projects.  Read and interpret drawings, sketches, prints, and specifications, as required.Orders parts as needed to affect maintenance and repair.Performs Operations tasks on an as-needed basis and other tasks as assigned.Available within a reasonable response time for emergency call-ins and overtime, plus provide acceptable off-hour contact by phone and company pager.          Excellent Verbal and Written Communications Skills:Ability to coordinate work activities with other team members on technical subjects across job families.Ability to work weekends, holidays, and rotating shifts, as required.","BENEFITSWhat is offered:Competitive compensation package100% matched retirement fundAnnual vacations paid for by companySignificant bonus structureOpportunity for advancement Full benefits packageAnnual performance reviews and base salary increasesAnnual cost of living increases Sound, clean, safe and enjoyable working environment &amp; Company CultureWorld renound management and executive team who promote from within, leverage careers and invest in employees for the long-term success of their careers and overall company/employee goalsQualified candidates contact: Darren Lawson | VP of Recruiting | #EMAIL_395225df8eed70288fc67310349d63d49d5f2ca6bc14dbb5dcbf9296069ad88c# | #PHONE_70128aad0c118273b0c2198a08d528591b932924e165b6a8d1272a6f9e2763d1#   ",1
174,Technician Instrument & Controls,US,"Technician Instrument &amp; ControlsLocation Deweyville, TXLocation Name: NRG Cottonwood EnergyCategory: MaintenanceState/City: US-TX-DeweyvilleType: Full Time Hourly# Openings: 1Details About this Career Opportunity:Overview:Company Profile:We deliver cleaner and smarter energy choices for our customers, backed by the nation’s largest independent power generation portfolio of fossil fuel, nuclear, solar and wind facilities. A Fortune 500 company is challenging the U.S. energy industry by becoming the largest developer of solar power, building the first privately-funded electric vehicle charging infrastructure, and providing customers with the most advanced smart energy solutions to better manage their energy use. In addition to 47,000 megawatts of generation capacity, enough to supply nearly 40 million homes, our retail electricity providers serve more than two million customers.GENERAL SUMMARYThe Instrumentation Controls and Electrical Technician (IC&amp;E) is responsible for the maintenance and repair of all instruments, control systems and electrical equipment in the power plant and the associated facilities. The IC&amp;E Technician performs work of high skill in the inspection repair, testing, adjustment, installation and removal of all electronic and electrical power plant equipment and systems.PRIMARY FUNCTIONS-Safely perform preventive and corrective maintenance on all plant equipment, systems, and emergency backup systems.-Maintain complete equipment files, logs, and drawings for all designated equipment.-Assist in maintaining and controlling spare parts inventory to maintain plant reliability. Assist in physical inventories.-Participate in the administrative maintenance of the plant operating manuals, technical references, prints and diagrams and preventive/predictive maintenance records.-Inspect repair, install and remove all types of motors, generators, transformers, switches, control equipment, wiring, electrical signal and communication systems, and storage batteries, and work with electrical systems up to and including 4160 volts.-Conduct trouble shooting and analysis on DCS, PLC and GE Mark VI turbine control equipment.-Maintain all plant instrumentation and electrical test equipment.-Fully support and participate in NAES Safety and Regulatory Compliance Programs.-Complete other tasks as assigned by the Maintenance Manager or the Plant Manager.SCOPE OF RESPONSIBILITYThe IC&amp;E Technician operates from established and well-known procedures under minimum supervision, performing duties independently with only general direction given. Decisions are made within prescribed operating and casualty procedures and guidelines. The ICE Technician encounters recurring work situations of high complexity, with occasional variations from the norm.The IC&amp;E Technician must perform work in a safe manner resulting in no accidents, in compliance with all environmental permits at all times. The ICE Technician must effectively communicate information to supervision and fellow plant personnel, relative to the condition of the plant equipment and performance, and provide suggestions for plant improvements. The ICE Technician must perform duties in such a way to result in an optimum cost-benefit ratio.The IC&amp;E Technician may also be assigned the additional responsibility of Maintenance Coordinator/Planner for the site. This is a collateral assignment given to a selected maintenance department technician to assist the Operations and Maintenance Manager with the routine planning and coordination of the site equipment maintenance.The duties include:-The planning and review of the preventative, predictive and pro-active type maintenance.-A more in-depth knowledge and ability to use the CMMS system to provide the necessary review and planning to support the O&amp;M Manager in weekly work routines.-Ability to provide the cognitive coordinated efforts necessary to ensure that weekly routines and preventative maintenance are scheduled and documented as complete when the respective maintenance technician indicates that the work has been performed.-Provide the coordination efforts necessary in support of allowing the O&amp;M Manager to provide the necessary supervision and direction of the maintenance technicians.All employees have the responsibility to both the customer and their co-workers to do the job right the first time and to ensure the customers' needs are being met.","we are a team of almost 8,000 employees who help power almost 40 million homes and have more than 2 million residential and business customers across the country. Together, we are powering progress every day—from California to Texas and New Jersey to Arizona.",1
181,Sales Executive,"PK, SD, Karachi",Sales Executive,Sales Executive,1
216,IC&E Technician Mt Poso,"US, CA, Bakersfield, CA / Mt. Poso","IC&amp;E Technician | Bakersfield, CA Mt. PosoPrincipal Duties and Responsibilities: Calibrates, tests, maintains, troubleshoots, and installs all power plant instrumentation, control systems and electrical equipment.Performs maintenance on motor control centers, motor operated valves, generators, excitation equipment and motors.Performs preventive, predictive and corrective maintenance on equipment, coordinating work with various team members.Designs and installs new equipment and/or system modifications.Troubleshoots and performs maintenance on DC backup power equipment, process controls, programmable logic controls (PLC), and emission monitoring equipment.Uses maintenance reporting system to record time and material use, problem identified and corrected, and further action required; provides complete history of maintenance on equipment.Schedule, coordinate, work with and monitor contractors on specific tasks, as required.Follows safe working practices at all times.Identifies safety hazards and recommends solutions.Follows environmental compliance work practices.Identifies environmental non-compliance problems and assist in implementing solutions.Assists other team members and works with all departments to support generating station in achieving their performance goals.Trains other team members in the areas of instrumentation, control, and electrical systems.Performs housekeeping assignments, as directed.Conduct equipment and system tagging according to company and plant rules and regulations.Perform equipment safety inspections, as required, and record results as appropriate. Participate in small construction projects.  Read and interpret drawings, sketches, prints, and specifications, as required.Orders parts as needed to affect maintenance and repair.Performs Operations tasks on an as-needed basis and other tasks as assigned.Available within a reasonable response time for emergency call-ins and overtime, plus provide acceptable off-hour contact by phone and company pager.          Excellent Verbal and Written Communications Skills:Ability to coordinate work activities with other team members on technical subjects across job families.Ability to work weekends, holidays, and rotating shifts, as required. ","BENEFITSWhat is offered:Competitive compensation package100% matched retirement fundAnnual vacations paid for by companySignificant bonus structureOpportunity for advancement Full benefits packageAnnual performance reviews and base salary increasesAnnual cost of living increases Sound, clean, safe and enjoyable working environment &amp; Company CultureWorld renound management and executive team who promote from within, leverage careers and invest in employees for the long-term success of their careers and overall company/employee goalsPlease Apply for Immediate Consideration. Qualified candidates contact: Darren Lawson | VP of Recruiting | #EMAIL_395225df8eed70288fc67310349d63d49d5f2ca6bc14dbb5dcbf9296069ad88c# | #PHONE_70128aad0c118273b0c2198a08d528591b932924e165b6a8d1272a6f9e2763d1#    ",1
358,Financing Auto(car) sales,"US, IL, hazelcrest",If you have experience in financing for auto sales and a great attitude you can work in our Hazelcrest office.  From $500 top $1000 a week by contract.,profit sharingcar allowancecompany car,1
574,Senior Engineering Product Manager,"US, CA, San Jose","Senior Engineering Product ManagerAs a member of the Service Provider Engineering team, you will be responsible for managing the development of broadband DSL products targeted at service providers that provide Home Gateway, voice gateways, wireless adapters, IPTV and Voice over IP (VoIP) services. These products will incorporate one or several of the following technologies: DSL, Routers, 802.11 Wireless, VPN, Firewalls.  The primary function of an engineering product manager is project management and technical oversight. The individual manages the ODM to ensure that products are delivered in a timely fashion to a high quality and in accordance with the procedures and systems. In addition the individual oversees the activities between the component vendors and the ODM. Within the service provider group, another important project management aspect is working with the sales engineers to get products approved at service providers. The individual must manage the technical issues that arise during the approval process and ensure a rapid resolution by working with and through the sales engineers, ODMs and Component vendors. A word from the Recruiter: ""Some of the exciting things that retain engineers here are the new technologies that we integrate into our products. Most People hear about these technologies 9 months after the product development has launched, our engineers actually start learning about the new technologies in advance of any silicon introductions. In most cases, we are an early partner to silicon vendors and help guide the silicon features. This is extremely rare for many of the new members, once they do the first project they want more and more. As you can imagine the value of that engineer is much greater then when they walked in the door."" ""Most engineers that I interview have been disappointed by their employers, and when asked how much ownership they have of the product they developed, the answer is always something like : I only did this this portion of the software, or some portion of the chip, or some portion of the hardware. Not much of an empowerment here.  Here, the PE is the complete owner of every molecule of the product, including mechanical, operation, finance, cost, etc. This empowerment is another added value boost an engineer could benefit from, this value is rare and will push the engineer in the direction of someday running a business end to end with a larger responsibility and scope. The more of these projects they take the faster they reach that level of career growth and maturity."" This is what not shared on the JD. ""How you will mature your career."" Job Responsibilities: • For assigned projects, take overall responsibility for delivering the product to production; including requirements generation, hardware, firmware, documentation, regulatory testing and Agile release requirements, per Netgear policies. It is expected that projects should be managed with minimal supervision. • Project management. Develop and maintain project plans. Keep all stakeholders informed of product status at all times• Project Execution. Manage the suppliers' (ODM, chip vendor, etc.) product development process. • Product Verification. Manage verification testing of product features and performance. • Customer Certification. Manage qualification of products with customers.• Documentation. Provide input for manuals, help files, application notes, marketing materials and tech support.• Support. Resolve any 3 rd level technical support escalations. • Track industry technology developments, supplier roadmaps, standards bodies and make product recommendations","What is offered:Broad responsibility, autonomy and visibility in an Engineering role.In-depth exposure to real-world customer issues across a global customer baseSmall-company feel in a growth environmentOpportunity for executive advancementVery competitive compensation packageSignificant stake in equity, stock optionsAttractive bonus programFull benefits package including generous retirement contributionsOpportunity for executive advancementReputable, renowned world-class leadership*Offering $1,000 Referral Bonus for each successful referral.Please contact: Darren Lawson directly at: #PHONE_90d33c9d7ec1484aebfe37b153d677decc6f5f53b316489ed24061544c04eb66# or #EMAIL_f4da338e899ddba983ac771b001681d1d2d93b3327ddc420a15f4e5a310071a9# #URL_99f46a2efd6ad483a11b40eef7a406a29de60d77be6dcb56289f26bd039c1017# ",1
604,Lead Mechanical Engineer,"US, TX, Houston","Corporate overviewAker Solutions is a global provider of products, systems and services to the oil and gas industry. Our engineering, design and technology bring discoveries into production and maximize recovery from each petroleum field. We employ approximately 28,000 people in about 30 countries. Go to #URL_0fa3f7c5e23a16de16a841e368006cae916884407d90b154dfef3976483a71ae# for more information on our business, people and values.We are looking for individuals who are prepared to take a position. Not only a position within Aker Solutions, but also a position on the exciting challenges the global oil and gas industry faces now and in the future.We are looking for a Lead Mechanical Engineer to join our team in Houston, Texas.The Lead Mechanical Engineer will be responsible for providing expertise and technical leadership to the organization.Responsibilities and tasks• Performs mechanical calculations and technical analysis on various custom components and reviews mechanical design of equipment to ensure that specifications are met;• Prepares and presents complex technical reports, equipment data sheets, MRQ’s, TBE’s and MRP’s, and makes recommendations on critical engineering issues;• Work with certifying agencies for product development and follows through with ABSA registrations;• Leads and reviews project design decisions, budgets, and scheduling;• Identifies solutions to achieve company objectives and ensure that the team is aligned.• Interfaces directly with the customer and participates in preparing bids and proposals;• Ensure processes are followed correctly and continuously identifies opportunities to improve efficiencies;• Ensure team members are kept current on procedure QMS changes;• Provides leadership, technical guidance and mentor-ship to other engineers.",We offer• Friendly colleagues in an industry with a bright future.• An environment where you are encouraged to develop your skills and share your knowledge with your colleagues.• Competitive benefits and strong focus on work-life balance.,1
629,UST Testing Technician II,"US, CA, Bakersfield","Qualified candidates are encouraged to apply directly to this job posting.  Direct email and phone calls are not being considered. Thank you for your cooperation.  Please no recruiters.  UST Testing Technician II Bakersfield, CA Local Petroleum Company operates primarily in retail and wholesale of motor fuels and other related petroleum products and is seeking talented, experienced, maintenance technicians to perform troubleshooting and maintenance on their retail gasoline equipment. RESPONSIBILITIESThe ideal candidate will have experience working with retail gasoline dispensing and peripheral equipment, UST systems, weights and measures compliance, and computer applications. Certifications with Gilbarco, Ruby, Sapphire, and VeederRoot Tank Gauging preferred.Schedule testing with local agencies. ","Competitive compensation package including base + full benefits package + expense account + per diem and increase in base + many perks.Clean, safe and professional working environment / culture.  The management team has a great reputation for taking good care of employees.  Steady, consistent employment opportunity- company has a history and reputation for the tenure of employees for the long-term. No layoffs or terminations. When work is slow the team always has work to keep current employees on a full-time status so you can feel confident your employment will be steady and something you can count on. If you like to travel and enjoy your independence, this position is for you. You will be traveling to multiple sites on overnight visits throughout the week and be working mostly independently. The position is available right away as we are prepared to move forward fairly quickly upon identifying the right candidate.  Qualified candidates are encouraged to apply directly to this job posting.  Direct email and phone calls are not being considered. Thank you for your cooperation.  Please no recruiters.  ",1
741,Health + Safety Professional,"US, CA, Bakersfield","Health &amp; Safety Professional | Bakersfield, CAThis position monitors, analyzes, recommends, and implements systems to improve integration of safety compliance and business success through interactions at the employee and supervisor levels. This position is part of the HSE team, and requires a person that is team oriented, and someone who is looking to share their knowledge while seeking new opportunities within and outside of the safety specialty.Work Environment;This position works primarily in a field environment supporting operations, drilling, production, and construction. The working conditions for this position vary and maybe hazardous and or unpleasant at times. The individual filling this position will be exposed to weather and temperature extremes, dust, oil, and other environmental factors. The person that fills this position must have a core belief that safety’s and production’s success are linked.","What is offered:Competitive compensation package100% matched retirement fundAnnual vacations paid for by companySignificant bonus structureOpportunity for advancement Full benefits packageAnnual performance reviews and base salary increasesAnnual cost of living increases Sound, clean, safe and enjoyable working environment &amp; Company CultureWorld renound management and executive team who promote from within, leverage careers and invest in employees for the long-term success of their careers and overall company/employee goalsQualified candidates please apply directly to this posting.  You may follow up with questions by contacting Darren Lawson | VP of Recruiting | #EMAIL_395225df8eed70288fc67310349d63d49d5f2ca6bc14dbb5dcbf9296069ad88c# | #PHONE_70128aad0c118273b0c2198a08d528591b932924e165b6a8d1272a6f9e2763d1#",1
813,UST Testing Technician II,"US, CA, Bakersfield","   UST Testing Technician II Bakersfield, CA Local Petroleum Company operates primarily in retail and wholesale of motor fuels and other related petroleum products and is seeking talented, experienced, maintenance technicians to perform troubleshooting and maintenance on their retail gasoline equipment. Responsibilities:The ideal candidate will have experience working with retail gasoline dispensing and peripheral equipment, UST systems, weights and measures compliance, and computer applications. Certifications with Gilbarco, Ruby, Sapphire, and Veeder Root Tank Gauging preferred.Schedule testing with local agencies. ","Competitive compensation package including base + full benefits package + expense account + per diem and increase in base + many perks.Clean, safe and professional working environment / culture.  The management team has a great reputation for taking good care of employees.  Steady, consistent employment opportunity- company has a history and reputation for the tenure of employees for the long-term. No layoffs or terminatins. When work is slow the team always has work to keep current employees on a full-time status so you can feel confident your employment will be steady and something you can count on. If you like to travel and enjoy your indipendence, this position is for you. You will be traveling to multiple sites on overnight visits throughout the week and be working mostly indipendently. The position is available right away as we are prepared to move forward fairly quickly upon identifying the right candidate.  Qualified candidates please apply for immediate consideration.  Darren Lawson | VP of Recruiting | #EMAIL_395225df8eed70288fc67310349d63d49d5f2ca6bc14dbb5dcbf9296069ad88c#",1
815,Project Manager: Engineer,"US, CA, Bakersfield","We are a full-service engineering, project management, design and safety regulatory firm providing a wide array of services to support our client's specific project needs.Essential Duties and Responsibilities:* Develop budget and schedule in alignment with the scope.* Able to understand and comprehend the major process steps involved in the project.* Adequate knowledge in project deliverables like Process Flow Diagram, PID, Area classification drawing, electrical one line drawing, etc.* Able to develop the project execution plan.* Interface with the client and develop rapport.* Request appropriate resources to execute the project work.* Manage the project personnel.* Effective communication skills - with the client and inter discipline personnel within the company.* Project tracking/monitoring - budget and schedule with the help of project control personnel.* Perform engineering calculations to support the project* Follow and implement standard project procedures per ProU Project Procedure Manual* Ability to relate project drawings with field construction.* Soft skills to manage multidiscipline technical staff and promote team spirit to execute the project successfully.* Ability to control the quality of project deliverables.","What is Offered:* Clean, safe, enjoyable environment to work in with a great company culture that values work/life balance.* Competitive base rate + Incentives + Full Benefits Package + Retirement 401K 100% matched by company.* Relocation Assistance. * Signing Bonus.* Opportunity for Advancement.* Trips, outings, rafting trips, lunches, client appreciation get-togethers, company parties, great people, great culture!",1
