job_id,title,location,description,benefits,fraudulent
1814,Mechanical Assembly & Test Technician,"US, TX, Houston","Corporate overviewAker Solutions is a global provider of products, systems and services to the oil and gas industry. Our engineering, design and technology bring discoveries into production and maximize recovery from each petroleum field. We employ approximately 28,000 people in about 30 countries. Go to #URL_0fa3f7c5e23a16de16a841e368006cae916884407d90b154dfef3976483a71ae# for more information on our business, people and values.We are looking for individuals who are prepared to take a position. Not only a position within Aker Solutions, but also a position on the exciting challenges the global oil and gas industry faces now and in the futureAker Solutions, with North America locations in Houston, Mobile, Bakersfield, Calgary and St. Johns, is looking for talented individuals who can strengthen our team and support our ambitious growth plans within the oil and gas market.Responsibilities and tasksGeneral Summary:1. Under general supervision, performs complex mechanical assembly operations, often to close tolerances, working from written and verbal instructions. 2. Uses hand tools, power tools, and measuring devices. 3. The individual shall maintain general awareness of all environmental aspects and related impacts during assigned work activities.Essential Functions:Performs any combination of the following duties in the assembly and of mechanical equipment:• Inspects parts for work orders brought from warehouse for damage and records traceability on work order. • Assembles product per specified procedures and quality requirements.• Is able to set up test equipment to facilitate required test procedures.• Is able to flush lines and perform cleanliness tests on flushed lines with minimal supervision• Is able to perform hydro, gas and FAT tests with no supervision.• Is able to troubleshoot any equipment failures.• Is able to interact with Engineering on any assembly and/or test procedure or BOM changes required.• Is able to interact with 3rd party inspectors and customers relating to their products. • Signs and is responsible for, proper documentation of each step in procedure performed.• Performs intermediate assembly tasks such as cleaning, stamping, and etching.• Marks and/or tags components so that stock inventory can be tracked and identified.• Maintains a clean and safe work area.• May be assigned to perform duties other than those listed above.","We offer• Friendly colleagues in an industry with a bright future.• An environment where you are encouraged to develop your skills and share your knowledge with your colleagues.• Competitive benefits and strong focus on work-life balance.Aker Solutions is a leading global oil services company with more than 150 years of industrial history and successful development. Today we have over 23,000 employees in over 30 countries. We are a growing company in developing markets and emerging regions. In North America, Aker Solutions operates eight business units creating many opportunities for our employees and customers. ",1
1822,Principal/Senior Mechanical Engineer (Package Equipment),"US, TX, Houston","Corporate overviewAker Solutions is a global provider of products, systems and services to the oil and gas industry. Our engineering, design and technology bring discoveries into production and maximize recovery from each petroleum field. We employ approximately 28,000 people in about 30 countries. Go to #URL_0fa3f7c5e23a16de16a841e368006cae916884407d90b154dfef3976483a71ae# for more information on our business, people and values.We are looking for individuals who are prepared to take a position. Not only a position within Aker Solutions, but also a position on the exciting challenges the global oil and gas industry faces now and in the futureAker Engineering &amp; Technology based in Houston is a leading international provider of front end studies, engineering, procurement and project management services needed for initiating and undertaking of contracts for the oil &amp; gas industry, both onshore and offshore. The company is also a major contributor of new technology and products, new knowledge and new methods for efficient cost saving and environmentally friendly exploitation of the world's oil and gas reserves.Responsibilities and tasksResponsible for the execution and co-ordination of the technical &amp; procurement activities of assigned packages, with a specific focus on Package Equipment (Makeup Water, Chemical Injection etc)....This includes activities such as:- Identify available equipment types for the specified equipment service and duty- Undertake equipment sizing to determine footprint and weight requirements, input to layout, electrical load and weight/cost estimate- Justify and recommend equipment selection and document the selection via study reports- Close cooperation with the Process, Layout and other disciplines to ensure robust solution.- Liaison with equipment suppliers to support the equipment selection process- Managing design interfaces for package equipment.- Compiling Technical Requisitions &amp; Specifications for Budget, Enquiry and Purchase Order.- Execution of technical Pre-Order Activities.- Evaluating Supplier bids/solutions for package equipment.",We offer• Friendly colleagues in an industry with a bright future.• An environment where you are encouraged to develop your skills and share your knowledge with your colleagues.• Competitive benefits and strong focus on work-life balance.•Friendly colleagues in an industry with a bright future•An environment where you are encouraged to develop your skills and share your knowledge with your colleagues•Competitive benefits and strong focus on work-life balance• A good and creative working environment in a technical driven organisation. • Interesting and challenging work tasks in one of the leading oil &amp; gas technology companies worldwide. • Good career development opportunities nationally and internationally • An expansive company under constant development,1
1823,Structural Engineer,"US, TX, Houston","Corporate overviewAker Solutions is a global provider of products, systems and services to the oil and gas industry. Our engineering, design and technology bring discoveries into production and maximize recovery from each petroleum field. We employ approximately 28,000 people in about 30 countries. Go to #URL_0fa3f7c5e23a16de16a841e368006cae916884407d90b154dfef3976483a71ae# for more information on our business, people and values.We are looking for individuals who are prepared to take a position. Not only a position within Aker Solutions, but also a position on the exciting challenges the global oil and gas industry faces now and in the futureAker Solutions’ drilling technologies business is part of a world leading supplier of drilling equipment, engineering solutions and project execution to the oil and gas industry.For our engineering office in Stockton-on-Tees, we need highly motivated individuals who can strengthen our team and support our ambitious growth plans within the drilling market.Responsibilities and tasks• Participate in project deliveries with responsibility for global and detail strength calculations of steel structures of a defined product area.• participate in concept studies and reviews• Use of Staad Pro for beam and element modelling and Abaqus for element modelling.• Hand calculations by use of basic formulas for preliminary calculations.• Follow up third part approval from DNV (Det Norske Veritas) and ABS (American Bureau of shipping)• Secure product safety in accordance with established standards.• Maintain and improve product quality and performance• Contribute to competitive product cost.• Advice mechanical engineers in structure issues.• work as partner in an integrated multi-discipline team",We offer • Friendly colleagues in an industry with a bright future.• An environment where you are encouraged to develop your skills and share your knowledge with your colleagues.• Competitive benefits and strong focus on work-life balance.•Friendly colleagues with high technical competence and good team spirit in an industry with a bright future• Inspiring work assignments in an international environment where you are encouraged to develop your skills and share your knowledge with your colleagues•Competitive benefits and strong focus on work-life balance• Competitive pension and personnel insurance schemes • Attractive welfare benefits,1
1844,Customer Service Representative,"US, TX, Houston","Experienced, reliable team members are needed for our Customer Service Representative needed! We are currently searching for candidates with previous experience and/or motivated quick learners. These positions require a friendly phone personality, great attention to detail and the ability to work quickly and efficiently. This is a customer contact position that requires patience, a great phone demeanor, excellent verbal and written communications, and reliable work attendance.Key Aspects of Position:Provide extraordinary service to our customers at all times.Work as part of a Customer Service team.Other duties as assigned.","Health, Dental, Life and AD&amp;D Insurance, Employee Wellness and 401k #URL_c801649eeb4007728c8f41b2d6629d92c2295ff77e1f2d401d7696ce3569db63# Time Off and Holidays with Generous Company Discounts",1
1858,Mechanical Technician,"US, TX, Houston","Corporate overviewAker Solutions is a global provider of products, systems and services to the oil and gas industry. Our engineering, design and technology bring discoveries into production and maximize recovery from each petroleum field. We employ approximately 28,000 people in about 30 countries. Go to #URL_0fa3f7c5e23a16de16a841e368006cae916884407d90b154dfef3976483a71ae# for more information on our business, people and values.We are looking for individuals who are prepared to take a position. Not only a position within Aker Solutions, but also a position on the exciting challenges the global oil and gas industry faces now and in the futureTo assemble, test, repair and/or refurbishment of controls equipment within the production department. Perform general duties within the workshop environment to assist manufacturing activities. To carry out any other requirements needed to allow the company to operate efficiently.Responsibilities and tasks• To work in a safe manner at all times, to comply with all current safety legislation and Company safety policy.• To work to ISO 9001. • To work to project specific quality plans.• To work at all times to the Company’s Quality Management System.• To complete all activities identified within the department work packs.• Perform strip down, assembly and test activities in line with work instructions and Standard Operating Procedures, under direct guidance and supervision.• Ensure all calibrated equipment used within the build, test process is within calibration date and rated for the work activities.• Maintain workshop plant and equipment including test equipment.• Ensure work area is maintained in a safe and tidy manner.• Play a pro-active role in housekeeping and continuous improvement initiatives.As necessary, perform other duties, requiring essentially the same level of skill &amp; responsibility, when required.",We offer• Friendly colleagues in an industry with a bright future.• An environment where you are encouraged to develop your skills and share your knowledge with your colleagues.• Competitive benefits and strong focus on work-life balance.,1
1923,Data entry,"US, TX, Fort Worth","Data Entry ClerkData Entry Clerk Job Purpose: Maintains database by entering new and updated customer and account information.Data Entry Clerk Job Duties:Prepares source data for computer entry by compiling and sorting information; establishing entry priorities. Processes customer and account source documents by reviewing data for deficiencies; resolving discrepancies by using standard procedures or returning incomplete documents to the team leader for resolution. Enters customer and account data by inputting alphabetic and numeric information on keyboard or optical scanner according to screen format. Maintains data entry requirements by following data program techniques and procedures. Verifies entered customer and account data by reviewing, correcting, deleting, or reentering data; combining data from both systems when account information is incomplete; purging files to eliminate duplication of data. Tests customer and account system changes and upgrades by inputting new data; reviewing output. Secures information by completing data base backups. Maintains operations by following policies and procedures; reporting needed changes. Maintains customer confidence and protects operations by keeping information confidential. Contributes to team effort by accomplishing related results as needed."," Health, Dental, Life and AD&amp;D Insurance, Employee Wellness and 401k plans. Paid Time Off and Holidays with Generous Company Discounts.",1
1961,Mobile Developer-Back End,"US, WA, Seattle","Managing over 200 TB of data, including 34 trillion+ weather simulation data points, 150 billion soil type observations, and more than   3 million daily weather measurements, we are one of the largest users of Amazon Web Services.Today we are focused on helping farmers protect and increase their profits in the face of increasingly extreme weather.  At the heart of the company is our unique technology platform, which encompasses our core competencies across weather monitoring, agronomic modeling, and weather simulation, and accounts for over 200 TB of data, including 34 trillion+ weather simulation data points, 150 billion soil type observations, and more than 3 million daily weather measurements.  This platform powers the company’s portfolio of technology-based products and services, which are revolutionizing agricultural risk management and farm management. We are leaving a mark on the world in our DNA; we want to make a lasting and meaningful real-world impact.  We relish big problems because they are the most interesting to tackle, the most rewarding, and typically the most valuable to solve.  We also thrive on finding the possible in the impossible.If you are the best at what you do, you like solving interesting problems, and you are looking for like-minded people dedicated to having a major impact on the world, we are eager to talk with you.Mobile Developer - Back EndWe are looking for experienced Ruby developers to join our engineering team, focusing on building back end support for the development of mobile applications for growers.What You Will Do:Write highly scalable and robust RESTful APIs to empower our mobile applications.Work closely with the iOS and Android team to ensure seamless integration with the back end.Opportunity to learn new technologies and frameworks.  ","What We Offer:Our team is composed of some of the most brilliant interdisciplinary minds in the industry. The environment is extremely engaging and fast-paced, with dozens of specialties coming together to provide the best possible product and experience for our customers.Competitive salary, excellent benefits, and some of the best perks in the industry, including:We provide meals and a large assortment of snacks, drinks, fruits, coffees, and teas to help you get through the day.We let you explore personally compelling topics by occasionally taking time to work on independent projects and contributing the results back to the open source community. Company sponsored outings, including go-kart races, kayaking, holiday yacht parties, and sporting events, etc.We sponsor hackathons, meetup groups, networking events, tech-talks, and conference trips. If you want to get involved in the tech community, we'll support your efforts. We encourage all employees to better understand our customers by getting out of the office and hearing firsthand from the agents and farmers our products serve.Energetic idea-driven work environment with an exciting culture.Exciting world-changing opportunity - we are solving problems that have a massive impact on the world!A driven, talented team that aims to make a large-scale impact through an innovative technology platform. ",1
1996,Customer service/ Data Entry,"US, AL,  ALEXANDER CITY","Customer Service SpecialistWe are currently looking for talented and creative individuals to continue growing the company. If you're looking to work in an organization where you can make a long-term home, and flex both your technical and creative skills, this may be the role for you! We pride ourselves on a work hard/play hard mentality and friendly, team-based culture.We're searching for a full-time Customer Support Specialist with strong customer service background, excellent communication skills and outgoing personality.Primary ResponsibilitiesRespond to incoming calls and e-mail / mail requestsContact current customersVerify payment requests over the telephoneDuring low volume intervals perform customer follow-ups, research escalated issues, and complete special projects","Benefits &amp; CompensationExcellent health insurance including medical, dental and vision401K with matching planPaid holidays, vacation and sick daysCompensation:Hourly., DOE ",1
2015,Assistant Account position!!!,"AU, , ","An exciting opportunity exists to fill a part-time position as an Assistant Accountant for an immediate start in Sydney region.In this role you will be a key member of our team, responsible for the overall bookkeeping duties of our clients. You will be required to be pro-active in your duties and take on any task required.",good salary,1
2020,"  Discipline Manager Civil, Structural, Marine, Architectural","US, TX, Houston","Corporate overviewAker Solutions is a global provider of products, systems and services to the oil and gas industry. Our engineering, design and technology bring discoveries into production and maximize recovery from each petroleum field. We employ approximately 28,000 people in about 30 countries. Go to #URL_0fa3f7c5e23a16de16a841e368006cae916884407d90b154dfef3976483a71ae# for more information on our business, people and values.We are looking for individuals who are prepared to take a position. Not only a position within Aker Solutions, but also a position on the exciting challenges the global oil and gas industry faces now and in the futureAker Solutions Engineering &amp; Technology division based in Houston, Texas, require a Structural Divisional Manager to provide leadership, supervision, and guidance to discipline and engineers and designers.Responsibilities and tasksRESPONSIBILITES:- Oversee all CSMA aspects of project execution within AETL office- Provide leadership, supervision and guidance to discipline engineers and designers- Estimate,plan and manage discipline budget- Undertake technical peer reviews of projects- Review discipline staffing requirements and assign suitably qualified and experienced persons to projects as required- Recruit CSMA personnel and build the AETL CSMA team- Support training and development of staff- Conduct annual performance reviews of staff- Develop and maintain discipline corporate processes and procedures- Generate discipline man-hour estimates and CTRs for projects and bids- Provide input to proposals in the form of narratives and reviews- Provide discipline input to bid evaluations, review tender documents, prepare SOW documents and deliverables- Develop and maintain good working relationships with clients across Aker Solutions offices- Maintain active contact with professional institutions related to CSMA- Keep up-to-date with technical developments, National and International standards and legislative requirements related to discipline.",We offer• Friendly colleagues in an industry with a bright future.• An environment where you are encouraged to develop your skills and share your knowledge with your colleagues.• Competitive benefits and strong focus on work-life balance.,1
2022,Subsea Process System Engineer,"US, TX, Houston","Corporate overviewAker Solutions is a global provider of products, systems and services to the oil and gas industry. Our engineering, design and technology bring discoveries into production and maximize recovery from each petroleum field. We employ approximately 28,000 people in about 30 countries. Go to #URL_0fa3f7c5e23a16de16a841e368006cae916884407d90b154dfef3976483a71ae# for more information on our business, people and values.We are looking for individuals who are prepared to take a position. Not only a position within Aker Solutions, but also a position on the exciting challenges the global oil and gas industry faces now and in the futureWe are looking for individuals who are prepared to take a position. Not only a position within Aker Solutions, but also a position on the exciting challenges the global oil and gas industry faces now and in the future. Aker Solutions is a world leading supplier of subsea pumping, compression, processing and power distribution systems for the subsea oil and gas industry. Currently we are realizing the Åsgard Subsea Compression System ready to start up in 2015. We see a development of market opportunities, where even more processing systems are moved subsea establishing the future subsea factory. Aker Solutions will split into two companies, one that will retain the Aker Solutions name and will focus on the subsea business and field design and a new oil-services investment company named Akastor consisting of six businesses that will be run independently.Aker Solutions’ subsea power and process unit is continuously improving solutions realizing the subsea factory. We are looking for highly motivated and creative engineers capable of shaping this future.We have several open positions at Houston, TX within subsea processing - separation, compression, and power systems. We need you to join the team in developing subsea processing solutions including separation, compression, flow assurance and pumps.Responsibilities and tasks• Take lead and be a driving force within subsea processing technology and systems from idea to the market. • Be the lead process system specialist in subsea processing projects, studies and concept developments, responsible for process system layout, design and simulations. • Be responsible for defining process system equipment.",We offer• Friendly colleagues in an industry with a bright future.• An environment where you are encouraged to develop your skills and share your knowledge with your colleagues.• Competitive benefits and strong focus on work-life balance.• A good and creative working environment in a technical driven organization.• Interesting and challenging work tasks in one of the leading subsea technology companies worldwide.• Good career development opportunities nationally and internationally.• An expansive company under constant development • Good personnel and pension insurances and welfare benefits for all employees.,1
2045,Management System Administrator,"US, TX, Houston","Aker Solutions is a global provider of products, systems and services to the oil and gas industry. Our engineering, design and technology bring discoveries into production and maximize recovery from each petroleum field. We employ approximately 28,000 people in about 30 countries. Go to #URL_0fa3f7c5e23a16de16a841e368006cae916884407d90b154dfef3976483a71ae# for more information on our business, people and values.We are looking for individuals who are prepared to take a position. Not only a position within Aker Solutions, but also a position on the exciting challenges the global oil and gas industry faces now and in the futureAker Solutions' Quality Management group based in Houston, TX, USA provides corporate and project Quality Management system support across the London organisation. We support bids, management and Project Management activities on all of our Oil and Gas production design and procurement projects. We need a talented, enthusiastic Management System Administrator who likes detail and is accomplished in all the standard Microsoft office systems including SharePoint sites and can strengthen our team and support our growth plans within the Offshore Oil &amp; Gas market.Responsibilities and tasks • Development, management and support of the Houston Corporate and Project SharePoint sites. Liaise with Oslo SharePoint facility owners and developers.• Support and management of ProArc facility holding Corporate London Operating System documentation• Word / Excel etc. Template support to project teams• PEM development, support and training.• General administrative and technical support to the HSEQ function in London• General admin support to the Global Quality, HSE and PEM networks• General admin. / technical support to Project Quality &amp; QC functions.• There is potential here to develop skills and capabilities within the HSEQ function and that could involve a number of possible opportunities including supporting the high profile Engineering improvement initiative.",We offer • Friendly colleagues in an industry with a bright future.• An environment where you are encouraged to develop your skills and share your knowledge with your colleagues.• Competitive benefits and strong focus on work-life balance.,1
