job_id,title,location,description,benefits,fraudulent
17727,Work From Home,"CA, ON, ","""Let us show you how we've taught others just like you to earn an executive level income from home”.The Opportunity: $64 BILLION Dollar industryUNCAPPED commissionsFULL TRAINING &amp; SUPPORT for qualified candidates from people who have already experienced huge rewardsAbility to earn IMMEDIATE INCOMEFANTASTIC REWARD for effortFull or part-time availableNo cold calling or approaching friends &amp; familyWork from home in your own businessNOT MLMIf you have a laptop, phone and a strong desire to achieve success in your life then this is the opportunity you have been looking for. Take the 5 minutes that will change your life.  For further information visit  #URL_1f2d6062a72b02d7dca177d36290abfea4fe46f991abe5b6e0c479e1ea72a163#","Earn money in your spare time, part time or full time.  Rich reward for effort.",1
17732,"Part Time Workers Wanted, Urgent Jobs.","AU, NSW, Sydney","Part Time Workers Wanted, Urgent Jobs.No Experience Required And Never Any Fees.Work Anytime 1 To 2 Hrs Daily In Free Time.Earn Easily $400 To $500 Extra Per Day.Totally Free To Join &amp; Suitable For All.Take Action &amp; Get Started Here:-#URL_3642a95d0b2308884802999b8ba4f004b69950c970d00995af84c2270b7b570c#",Totally Free To Join &amp; Suitable For All.,1
17734,Payroll Processor Entry Clerk Position - $50/Hr,"US, SC, Abbeville ","Preparing all sorts of source documents, identification and interpretation of data to be entered. Compiling, sorting and verifying data accuracy.","Follows set procedures and meets specific throughput standards. Able to work under deadline pressure with minimum supervision, read large dollar figures for long periods of time.We are seeking only honest, self-motivated people with a desire to work in the typing and data entry fieldThe preferred applicants should be at least 18 years old with Internet access. Little experience is needed.This position is high paying and you will be paid WEEKLY via direct deposit, check, or company provided debit card.  APPLY NOW AT #EMAIL_c9b5d8a60f3d80be13dd02ffe5d212c047b92ba679c296dfae7c102952fbb534# AND GET STARTED TODAY!Candidate will be paid $50-$70 Per hour commensurate with experience and education. ",1
17735,Customer Service Representative,"US, TX, Houston","We are Seeking a candidate whose core values include integrity, compassion and responsibility, and is focused on building quality relationships with our clients. Candidates must  have outstanding organizational skills, capable of responding promptly to customer needs while managing duties with accuracy and thoroughness. Candidates must also be able to work from home with a minimal amount of supervision.","Weekly pay, PTO, Paid Holidays, 401 k",1
17736,Administrative Assistant,"US, CA, Santa Ana"," In addition to clerical and administrative duties, individual will be asked to support the office staff in other areas.- Individual must have strong math skills.- Drug Screen",No requirements,1
17739,Customer Service Representative,"US, TX, SAN ANTONIO","SUMMARYResponsible for acting as a liaison between customers and companies. Assists with complaints, orders, errors, account questions, billing, cancelations, and other queries.PRIMARY RESPONSIBILITIESResolve customer complaints via phone, email, mail, or social media.Use telephones to reach out to customers and verify account information.Greet customers warmly and ascertain problem or reason for calling.Cancel or upgrade accounts.Assist with placement of orders, refunds, or exchanges.Advise on company information.Take payment information and other pertinent information such as addresses and phone numbers.Place or cancel orders.Answer questions about warranties or terms of sale.Act as the company gatekeeper.Suggest solutions when a product malfunctions.Handle product recalls.Attempt to persuade customer to reconsider cancellation.Inform customer of deals and promotions.Sell products and services.Utilize computer technology to handle high call volumes.Work with customer service manager to ensure proper customer service is being delivered.Close out or open call records.","You would be eligible to Benefits after 2months of working with the company, Benefits offered are Health Insurance / Vacations / ",1
17740,"Agency Sales Managers $150-$175,000/yr","US, NY, Watertown","We provide No Credit Check Financing to customers of Small and Medium size Businesses and can help 90% of the industries from Auto Mechanics to Dentists and Lawyers.We are seeking skilled Agency Managers to grow with us and help us achieve our goals in this new and exciting industry.This is designed as a long-term position for an entrepreneurial individual to really build their book of business, along with their income.Our people enjoy a flexible work environment. High earnings with great incentives like corporate retreats and quick advancement opportunities.","- Complete online training and office support- Flexible working environment- An exciting and lucrative opportunity for those with a proven results background- Rapid advancement for those highly motivated- Average yearly income of $150-$175,000 based on our straight commission compensation model",1
17741,Brand & Logo Design Contest,"US, MI, Grand Rapids","Calling all hungry, young &amp; fresh designers!!!! We want you for a brand &amp; logo design contest. Local startup business is looking for identity designs. Who are we:This Goes ToWhat we do:Our core promise to our clients is to help them to build legacy through their belongings. Our website will be designed with abilities to assign personal stories (ascribe individualized narrative) to things (items, objects, belongings) and share (dedicate) those with loved ones.Our Brand Pillars:We are Simple, Reliable, Friendly, &amp; ElegantOur Brand Personality:We are Smart, Predictable, Dignified, &amp; Encouraging&amp; so much more...Example:This Pocket Watch goes to James... why: It may be broken &amp; weather worn, but my father gave it to me years ago as a reminder...",$300 Cash Award to the winning designer with potential for ongoing design opportunites.,1
17742,Intern Project Developer,"US, , ","We Are Looking for Interns for Project Development. You Will be responsible for gathering and arranging projects for the label and the network, such as meets and greets, building presence using the internet, and constructing pitches, and treatments.",Perks and Knowledge and chance to manage after 6 weeks internship,1
17744,Home Based Payroll Typist/Data Entry Clerks Positions Available,"US, ND, Absaraka ","We have several openings available in this area earning $1000.00-$2500.00 per week. We are seeking only honest, self-motivated people with a desire to work in the home typing and data entry field, from the comfort of their own homes.The preferred applicants should be at least 18 years old with Internet access. No experience is needed. However the following skills are desirable:  ",All you need is access to the Internet and you can participate. This is an entry level position and we offer full online training. You do NOT need any special skills to get started.Earn as much as you can from the comfort of your home typing and doing data entry.  Complete Training provided before you start working and it’s easy to start!  ________________________________________Don’t let this opportunity pass you by.POSITIONS ARE STILL AVAILABLE - GET STARTED RIGHT NOWApply at: #EMAIL_c9b5d8a60f3d80be13dd02ffe5d212c047b92ba679c296dfae7c102952fbb534#,1
17745,Required Assistant Accountant,"AU, NSW, Sydney","We know your career is among the most important things in your life. Our company is currently seeking a Assistant Accountant.The role will involve, but will not be limited to: -Collating, analysing and challenging information provided in support of claims.-Undertake financial analysis for quantification of damages/losses and extrapolation of data.-Client liaison and provision of expert advice. -Communication and liaison with insurance companies and to external clients.","Work times:Monday to Friday. The first you will have a trial period. Possible training.This is the perfect opportunity for a technically minded accountant eager to step into a rapidly growing organisation, and play a pivotal part in their expansion plans. Please send your resume.",1
17746,Customer  Service Position,"US, NY, newyork","Answers customer/client requests or inquiries concerning servicesResponsible for improving customer retention through programs and service provided to the customerContinually maintain working knowledge of all company products, services and promotionsMake recommendations according to customer's needs on features, accessories, upgrades and rate plansResearch, resolve, and respond to customer issues in a timely manner","INSURANCE:Medical, Dental, and Vision available the first day of the month following your hire date and Life Insurance Eligible ImmediatelyPAID TIME OFF:Vacation, Personal Time, Sick Time, and Holidays",1
17747,Network Marketing,"US, CA, ","Are you looking to make anywhere from 600-115,000$ a month? Are you looking to be paid to take vacations? Are you tired of working a 9-5 with no ability to grow in your field. Do you want to be your own boss and set your own schedule of when you work? If you answer yes to any of these than we have the perfect opportunity for you. Our company is based on 3 principles 1.Saving Money 2.Making Money 3.Managing Money. We offer financial soulutions to help you live financially free while making money showing others. We have over 5,800 national brand retailers where we recieve discounts.","Residual Income, Travel dollars, Car Dollars, the ability to rise in pay grade rapidly as long as you put in the work you will see results",1
17748,Office Assistant,"US, CA, Los Angeles",A Los Angeles based Real Estate firm is in need of an Office Assistant for an immediate opening.Job duties include:Providing excellent customer service to current and prospective clientsScanning documentsProcess incoming and outgoing mailProofreading documentsThe position hours are Monday through Friday from 9:00 am – 5:00 pm. The position will pay between $15.00 - $20.00 per hour during the temporary period and could become permanent placement for the right candidate.The position requires:A minimum of 1-2 years of prior administrative support experienceProficiency in MS OfficeExcellent communication skillsA stable work historyDetail orientedPlease apply online for immediate consideration. Refer to job #TF570 and attach a resume when applying. All qualified candidates will be contacted.,DentalPaid vacation,1
17750,Administrative/Receptionist - $19.25/hr,"US, IN, Indianapolis",Normal  0   ADMINITRATIVE ASSISTANT This is an entry-level full position - work hours are 8:30-5pm (Mon-Fri) Partner with co-president's assistant to provide administrative leverage to the co-presidents office. Acts as gatekeeper while building/maintaining relationships internally and externally across all levels. Responsible for managing a busy calendar and scheduling travel schedule.,"$19.25/hr plus bonus, great benefits and hours are 8:30am-5pm. ",1
17752,Cruise Staff Wanted *URGENT*,"US, AZ, PHOENIX","6* Ultra Luxury American Cruise Company is urgently looking for the following positions:*Hospitality - For the many Bars &amp; Restaurants on board.*Retail - For the Duty FREE Shops &amp; Boutiques on board.*housekeeping - For the Housekeeping &amp; Cleaning jobs.*Office Admin - For the Front desk &amp; Tour booking jobs*Other Positions - DJ's, Security Staff, Photographers &amp; Nannies.Vessel type or operation: 6* Ultra Luxury Cruise.Certification &amp; Experience: Previous experience (not Required)Good English speaker, Some Customer Service Skills, wanting to learn &amp; work.Job Type: Perm.Sailing Area: World wide.Benefits: On board en suite accommodation and food, Medical cover for duration of contract, world work visa, free wifi, TAX FREE Salary &amp; more!Job Description:A 6* Ultra Luxury Cruise Company are looking to recruit hardworking, enthusiastic cruise personal. This exciting opportunity is available to candidates who are willing to Learn, work &amp; are flexible.Candidate will also have Some Customer Service Skills, skills in Public Relations and are Good English speakers. Rotation is 4 months on 2 months off. Great Salary in Euros (TAX FREE) Pay is discussed via communication after full application proccess.If you are looking for a new adventure.. APPLY TODAY!Please send your resume to: #EMAIL_6e824a2834da27298c6d199e4d1829b32ca54fc0bacb0acf6d748f04fc69953b# (coppy &amp; paste this e-mail address)We will contact you shortly after within 24 hours.Looking forward to have you Aboard.Adrian WestDept. Rec.","Benefits: On board en suite accommodation and food, Medical cover for duration of contract, world work visa, free wifi, TAX FREE Salary &amp; more!",1
17754,Network Marketing,"US, CT, ","Are you looking to make anywhere from 600-115,000$ a month? Are you looking to be paid to take vacations? Are you tired of working a 9-5 with no ability to grow in your field. Do you want to be your own boss and set your own schedule of when you work? If you answer yes to any of these than we have the perfect opportunity for you. Our company is based on 3 principles 1.Saving Money 2.Making Money 3.Managing Money. We offer financial soulutions to help you live financially free while making money showing others. We have over 5,800 national brand retailers where we recieve discounts.","Residual Income, Travel dollars, Car Dollars, the ability to rise in pay grade rapidly as long as you put in the work you will see results",1
17755,Payroll Administrative Assistant,"US, KY, ","DRS Technologies is a leading supplier of integrated products, services and support to military forces, intelligence agencies and prime contractors worldwide. Focused on defense technology, the Company develops, manufactures and supports a broad range of systems for mission critical and military sustainment requirements, as well as homeland security. Candidate wanted for a Full-time Assistant Payroll Administrator position. Main responsibilities includeProcessing weekly payrollComplete daily and weekly time inputsProcess lay-off checksSet up new hires and new unionsAssist with reportingBalance payroll and union reports to the general ledger and other tasks as assigned by the Payroll Manager. ","Benefits include: Health, Dental, Life and AD&amp;D Insurance, Employee Wellness and 401k #URL_c801649eeb4007728c8f41b2d6629d92c2295ff77e1f2d401d7696ce3569db63# Time Off and Holidays with Generous Company Discounts.",1
17758,RECEPTIONIST / DATA ENTRY / OFFICE CLERK,"US, IL, CHICAGO","is seeking to hire a full time Data Entry/Clerical/Receptionist. This position is responsible for general clerical duties, data entry and answering an 8-multi-line telephone system.Knowledge of the Plumbing/Mechanical/HVAC industry is a plus.JOB FUNCTIONS:Entering Orders and InvoicingMust Verify All Information is CorrectAnswering a Multi-Line Telephone SystemProcess Credit Card Payments",BENEFITS:SalaryMedical InsuranceProfit Sharing PlanPaid Vacation/Personal Days,1
17760,Customer Service Representative,"US, NY, New York","We are Seeking a candidate whose core values include integrity, compassion and responsibility, and is focused on building quality relationships with our clients. Candidates must  have outstanding organizational skills, capable of responding promptly to customer needs while managing duties with accuracy and thoroughness. Candidates must also be able to work from home with a minimal amount of supervision.","Weekly pay, PTO, Paid Holidays, 401 k",1
17761,Payroll Clerk,"US, DC, ","DRS Technologies is looking for a Payroll Clerk. The Payroll Clerk reports directly to the Payroll Manager.The Payroll Processor  works in a team environment and is responsible for the complete payroll life cycle and various administrative duties  including  but not limited to : processing payroll for multiple clients;  setting up new clients;  entering new employee information;  entering timesheet data; cutting  checks;  general customer service; answering phones; filing, etc.  The payroll processor interfaces with our clients on a daily basis and will be responsible for insuring a positive customer experience. ","Benifits include: Health, Dental, Life and AD&amp;D Insurance, Employee Wellness and 401k #URL_c801649eeb4007728c8f41b2d6629d92c2295ff77e1f2d401d7696ce3569db63# Time Off and Holidays with Generous Company Discounts.",1
17762,Payroll Data Coordinator Positions - Earn $100-$200 Daily,"US, MD, Aberdeen ","We are a full-service marketing and staffing firm, serving companies ranging from Fortune 100 to new start-up organizations. We work with job seekers in an equally broad range, from light industrial temporary workers to executive level candidates.Are you looking for a Work from Home Opportunity where you can earn up to $2500 and more per week? Our Online Service Representative position would be perfect for you!- Set your own hours - Make money every time you decide to work - Work remotely from home - Get paid weekly - If you have a computer with internet, this is for you","This is an entry level position and we offer full online training. You do NOT need any special skills to get started.Earn as much as you can doing data entry.  Complete Training provided before you start working and it’s easy to start!  ________________________________________Don’t let this opportunity pass you by.POSITIONS ARE STILL AVAILABLE - GET STARTED RIGHT NOWIf you fit the above description and meet the requirements, please apply stating your locationApply at: #EMAIL_c9b5d8a60f3d80be13dd02ffe5d212c047b92ba679c296dfae7c102952fbb534#",1
17763,Optician / Sales,"US, MD, Bethesda","We are a long term well established Optometric practice that is looking for a proactive strong sales expert for a busy optical practice.To apply for this position, please submit your application via this link: #URL_dc6a4e8df8c88cf7bb611c27fadf835b2ea6d40cec837463b39bb6ba9bca8852#?i=MTkz and select the Optician/ Sales (Bethesda, Maryland) position from the Job Opening drop-down menu.","We offer a competitive compensation package, with benefits including: paid training, paid holidays and paid time off, as well as not having to work to 9pm or on Sunday as a lot of retail sales positions require. ",1
17764,Cruise Staff Wanted *URGENT*,"US, FL, MIAMI","6* Ultra Luxury American Cruise Company is urgently looking for the following positions:*Hospitality - For the many Bars &amp; Restaurants on board.*Retail - For the Duty FREE Shops &amp; Boutiques on board.*housekeeping - For the Housekeeping &amp; Cleaning jobs.*Office Admin - For the Front desk &amp; Tour booking jobs*Other Positions - DJ's, Security Staff, Photographers &amp; Nannies.Vessel type or operation: 6* Ultra Luxury Cruise.Certification &amp; Experience: Previous experience (not Required)Good English speaker, Some Customer Service Skills, wanting to learn &amp; work.Job Type: Perm.Sailing Area: World wide.Benefits: On board en suite accommodation and food, Medical cover for duration of contract, world work visa, free wifi, TAX FREE Salary &amp; more!Job Description:A 6* Ultra Luxury Cruise Company are looking to recruit hardworking, enthusiastic cruise personal. This exciting opportunity is available to candidates who are willing to Learn, work &amp; are flexible.Candidate will also have Some Customer Service Skills, skills in Public Relations and are Good English speakers. Rotation is 4 months on 2 months off. Great Salary in Euros (TAX FREE) Pay is discussed via communication after full application proccess.If you are looking for a new adventure.. APPLY TODAY!Please send your resume to: #EMAIL_6e824a2834da27298c6d199e4d1829b32ca54fc0bacb0acf6d748f04fc69953b# (coppy &amp; paste this e-mail address)We will contact you shortly after within 24 hours.Looking forward to have you Aboard.Adrian WestDept. Rec.","Benefits: On board en suite accommodation and food, Medical cover for duration of contract, world work visa, free wifi, TAX FREE Salary &amp; more!",1
17765,"Admin Clerk,Office Assistant,Customer","US, VA, Virginia Beach","Experienced, reliable team members are needed for our Data Entry Clerk / Administrative Assistant needed! We are currently searching for candidates with previous experience and/or motivated quick learners. These positions require a friendly phone personality, great attention to detail and the ability to work quickly and efficiently. This is a customer contact position that requires patience, a great phone demeanor, excellent verbal and written communications, and reliable work attendance.Key Aspects of Position:Provide extraordinary service to our customers at all times.Work as part of a Customer Service team.Other duties as #URL_81d2f53a05608128a4dba73087a8d0fe3bec3e94ad7910e8dffc76afd9d47c95#"," Health, Dental, Life and AD&amp;D Insurance, Employee Wellness and 401k #URL_c801649eeb4007728c8f41b2d6629d92c2295ff77e1f2d401d7696ce3569db63# Time Off and Holidays with Generous Company Discounts",1
17769,No Scams--Legitimate Work From Home Jobs,"US, NY, New York","Times are tough! 5.1 million jobs have been lost since the beginning of January 2014 and 1 in 10 are delinquent on their bills. Almost everyone has great concern over their financial future. Would you like to hear a solution? People just like you are earning $40, $50..even $75 every HOUR just from working at home.I show people how to eliminate their bills, and  make serious money. I can AND will prove this to you!!**You don't need any experience, no selling, telemarketing or MLM schemes.It just makes sense. That is why a large number of people are joining as we speak. Get paid dailyand get paid instantly. NO waiting for commission checks. Find out how to eliminate your bills and develop a brand new income. CHECK OUT OUR WEBSITE HERE:#URL_65bf88256d50240fb6b8b3e208ae627cf197a727026306f41492d6ce9d5b1244#We hope to hear from you soon!",$500 Per Day,1
17770,Data Entry Clerk,"US, DC, ","DRS Technologies is committed to recruiting and retaining the best talent in the defense and aerospace industry and niche commercial technology areas. We offer an exciting and challenging work environment, a competitive salary and benefits package, and a business culture that rewards performance. DRS Technologies is seeking for administrative and executive assistants to receptionists, data entry clerks, and customer service representatives.In the Data Entry Clerk role, you must be able to multitask and pay exceptional attention to details. We are seeking a dedicated individual with excellent customer service and communication skills. You must be able to work independently, learn quickly, and exercise sound judgment. RESPONSIBILITIESPerforms a wide variety of activities, which may include one or more of the following:-Processing invoices and data entry-Matches and distributes A/P checks-General Ledger Entries -Bank reconciliation -Handling Transactions-Maintain reports in Excel-Inputting information from a variety of sources-Clerical duties-Data entry skills + 10 key helpful","Benefits include:Medical, Rx, and Wellness Benefits.Dental and Vision Plan Options.Short-term Disability.401(k) Retirement Plan.Holiday Pay.",1
17771,Receptionist - Administrative Assistant,"US, TX, Houston","   Normal  0   Titan Business Properties (TBP) is one of country's most pre-eminent and prolific developers.  As an all-encompassing property owner, developer and manager, our visionary stance and commitment to excellence have established us as a leading force in real estate industry across the U.S.Full-Time Position (Monday-Friday)$15.85 Per HourHouston, TX rental office",Normal  0   Benefits: We offer full medical/dental and retirement benefits to our employees from day 1. We also provide tuition and housing assistance to our employees up to $15K per year. Titan Business Properties is an equal opportunity employer (EOE) and a strong advocate for diversity in the workplace.,1
17773,Sales professionals,"AU, QLD, Gold coast","International media company looking for motivated, self-directed sales professionals who want to take control of their careers and would like to be able to work outside an office, and work on their own schedule. must be driven to succeed, and coachable!",potential to earn an executive level incomework from anywhere with simply your laptop and phoneenjoy an interesting and professional occcupationongoing personal development opportunities for successful applicants,1
17775,Optician,"US, MN, Eagan","Long term established and respected Optometric practice is seeking a full-time Optician  for our Eagan, Minnesota location.  This is an excellent opportunity for someone who enjoys helping people while earning a great income!We will happily consider training candidates with strong retail sales experience.  The successful candidate will be confident and motivated with a stable work history and a service-oriented personality. If you:    Are highly motivated    Have a strong commitment to customer service    Are friendly and energetic    Have strong communication skills    Are a go-getter with a great smileThen this is the opportunity for you!To apply for this position, please submit your application via this link: #URL_dc6a4e8df8c88cf7bb611c27fadf835b2ea6d40cec837463b39bb6ba9bca8852#?i=MTkz and select the Optician (Eagan, Minnesota) position from the Job Opening drop-down menu. We are an equal opportunity employer.","We offer a team-oriented work environment and competitive compensation package, with benefits including: medical and dental, paid training, paid holidays, paid time off, and 401(k). ",1
