job_id,title,location,description,benefits,fraudulent
2786,Assistant Accountant/immediate start,"CA, ON, Toronto","Our organisation is seeking students / graduates with a finance, business or commerce related degree qualifications. We want to hear from you if you are seeking experience in genuine, professional environments. We have several exceptional positions available for immediate start. You will be degree qualified or partially through your degree with good attention to detail as well as good communication skills. You will also have strong organisational skills, a willingness to learn coupled with exceptional numerical skills.Position: You will ultimately be responsible for supporting the accounting team in general finance admin responsibilities. This will include high volume data entry that will require phenomenal attention to detail and strong Excel skills. You will be responsible for working proactively to investigate and resolve queries with internal stakeholders.","Get trained and get paid for it. Flexible hours, 20 hrs per a week. If you are interested in this opportunity, please send your CV.",1
2891,"Compensation Consultant, Toronto, ON, Canada","CA, ON, Toronto","Responsible for leading Compensation for the Americas including responsibility for US team members in the International Business and all team members in Canada and Latin America. Serves as a Compensation Consultant to management within various lines of business across the Enterprise and reports to the Manager of International Compensation. Partners effectively with Shared Services in Employee Relations, Corporate Compensation, Talent Acquisition and Recruiting.Minimum Qualifications6+ years consulting experience in compensation, human resources, accounting or finance.6+ years Incentive design expertiseStrong business acumen, detail oriented, strong interpersonal and negotiation skills, team player, results oriented, self motivated, and innovativeExpert strategic, analytical and conceptual problem-solving skillsExpert at managing multiple clients and projectsExcellent verbal and written communication and presentation skillsExcellent in MS Excel, PowerPoint, Word, and Access",Salary:119k CADskype: #URL_d55e4b14429646a9eb93865cecc97aacd2825df075948232385e8999972dad8d#email: #EMAIL_11728081a815d4106982c8e46f4d73c3c78f5c0d57a1a2517ba10dfe4dc9b09e#,1
2893,Marketing Database Decision Strategy Consultant,"US, CA, San Francisco","Looking for a modeling manager who is self-starting and proactive, wants to have an impact and own end to end results of their work. This modeling manager will be responsible for managing a team that develops predictive marketing models for Small Business credit product campaigns across multiple channels. Routine tasks will involve staff management and hands-on model development, technical documentation, oversight of model reviews and model implementation, and daily collaboration with the data and analytics teams. The modeling manager must be very familiar with statistical concepts that pertain to predictive models. Broader, practical knowledge of applied statistics, experimental design, and data mining would also be important. He or she will employ multiple databases across multiple data sources with different time period to obtain small business data with various levels of detail, to develop, validate, and oversee development of models that predict events along the credit product acquisition cycle. Regular communication with business partners will be required. The modeling manager must be comfortable in the role of advocate for the business, when seeking approvals from legal and compliance personnel for new or revised marketing models, when making recommendations to senior management, and with occasional opportunities to share information across the company. Adaptability to a changing legal and compliance environment is imperative. Basic Qualifications 10+ years marketing analytics and predictive modeling experience. Minimum Qualifications Masters degree in statistics, operations research, or another field of applied statistics.10+ years of hands-on statistical applications in the financial services, consumer products marketing, or another related business area.Experience with campaign execution and database marketing.Demonstrated creativity with problem solving skills.Proficient with the SAS BASE and STAT modules, SAS macro language, and SQL.Practical experience with logistic regression models and scorecards.Ability to design and provide information for model reporting processes.Skill with preparing highly detailed model-related documentation, which would be subject to several levels of approval.Demonstrated ability to share analytical results effectively to non-modelers, including management, law and compliance groups, and others.Ability to manage a predictive modeling team as a hands-on contributor.Embraces teamwork and collaboration, and is regarded by colleagues as a respected authority in applied statistics.Must be flexible, able to thrive, and meet stringent deadlines, in a rapidly changing, fast paced environment.Ability to adapt new environment quickly with change management experience Strong oral, written, and interpersonal communication skills.",Salary: 180kIf you have all the necesary skills please contact me either on:skype: #URL_d55e4b14429646a9eb93865cecc97aacd2825df075948232385e8999972dad8d#email: #EMAIL_11728081a815d4106982c8e46f4d73c3c78f5c0d57a1a2517ba10dfe4dc9b09e#,1
2898,Support Team Member,"US, TX, Austin",Benefits Company looking to hire Support Team Members. This is a virtual position and all Candidates must be comfortable working from their homes.,Weekly PayPTO,1
2922,Church Administrator/ Secretary,"US, OH, Cincinnati","Description of the Church Administrative AssistantThe Church Administrative Assistant serves under the direct supervision of the Senior Pastor, to manage all activities of the main church office and perform administrative duties related to the church’s operation. This is a full time #URL_b74a96d67e677fe50326f5185df3e9f22ca81b928c4e286b6d7dccc397d2e7ac# for this postion should be of a Pentacostal or Baptist background and the church is apart of the Full Gospel Church Fellowship Organization.",Competitive weekly pay and full benefits after 90 days.,1
2928,"LEAN Program Manager, Carol Stream, IL","US, IL, Carol Stream","The LEAN Programs Manager will lead strategic, enterprise-level initiatives to deliver short term results as well as long term sustainability. This will include facilitating tactical and strategic kaizens with senior business leaders, promoting and guiding LEAN cultural transformation and coaching LEAN principles at various levels of the organization. LEAN Programs Manager will also be required to conduct training, and coach and mentor LEAN Facilitators, LEAN Application Specialists, LEAN Field Champions and other Green Belts, Yellow Belts, etc.Responsibilities and essential job functions include but are not limited to the following:Initiate, develop &amp; manage new LEAN enterprise-level initiatives within client’s headquarters and operating groupsDevelop and execute the implementation strategy for current LEAN initiatives at various branch sites throughout client and ensure specific objectives and results are achievedActively participate in the development and execution of the LEAN embedment strategy via training, coaching and mentoring of LEAN Practitioners (LFCs, Green Belts, Yellow Belts, etc.) and LEAN Leaders (Blue Belts)Assist in the development of LEAN Facilitators and LEAN Application Specialists through personal example, coaching/mentoring and formal/informal training sessions may include direct reporting relationship Ensure adequate delegation and clear definition of responsibilities to each member in the development and implementation of initiativesLead various kaizen (continuous improvement) events in a team setting and demonstrate successful outcomes select and utilize appropriate LEAN toolsPromote a team working relationship amongst LEAN group membersProvide executive level updates regarding initiative key components, results, accomplishments, etc.Promote out-of-the-box thinking and continuously generate new ideas to improve processes, service, efficiency, inventory, cost and space Serve as a catalyst to promote LEAN thinking and foster a continuous improvement culture throughout the companySummary of Experience · Minimum of 15 years of experience with a Fortune 500 company recognized for their continuous improvement/LEAN culture (10 years is not adequate for this role)Experience in supply chain, distribution and/or logistics functions strongly preferred",Salary:120K,1
2931,Data Entry Clerk,US,CPI Data Services has partnered with a growing company to fill a Data Entry/Excel specialist position. Our client is seeking a strong data entry clerk toextract information from an AS400 system and from paper documents then enter the data into an Excel spreadsheet. We are seeking an individual with both speed and accuracy!Candidates need to be proficient with data entry and high level of proficiency with ExcelStrong attention to detail needed and low error rate on data entry tests will be required.This is a shift position with Flexible hours to midnight Monday to Friday.This position is IMMEDIATE!Interested candidates should forward their resume ... be prepared to take data entry tests. Requirements: Data Entry experience and skillsAS400 Entry level/experience helpful but not requiredGeneral MS Excel/MS Word experience required.,Wage rate per hours,1
2978,Administrative Assistant/Customer Service,"US, CA, San diego","We have Entry Level and Experienced Level positions available! Job Purpose: Maintains database by entering new and updated customer and account information. Utilizing your clerical and office experience, you will be a valuable member of our data entry team. Requirements: * Prepares source data for computer entry by compiling and sorting information; establishing entry priorities. * Processes customer and account source documents by reviewing data for deficiencies; resolving discrepancies by using standard procedures or returning incomplete documents to the team leader for resolution. * Enters customer and account data by inputting alphabetic and numeric information on keyboard or optical scanner according to screen format. * Maintains data entry requirements by following data program techniques and procedures. * Verifies entered customer and account data by reviewing, correcting, deleting, or reentering data; combining data from both systems when account information is incomplete; purging files to eliminate duplication of data. * Tests customer and account system changes and upgrades by inputting new data; reviewing output. * Secures information by completing data base backups. * Maintains operations by following policies and procedures; reporting needed changes. * Maintains customer confidence and protects operations by keeping information confidential. * Contributes to team effort by accomplishing related results as needed. Skills/Qualifications: Data Entry, Clerical Office, Organization, Typing, Data Entry Skills, Attention to Detail, Confidentiality, Thoroughness, Decision Making, Independence, Analyzing Information , Results Driven, Energy Level (send a copy of your resume to #EMAIL_eaf2ba300439c57f456cbed67d1cff9f45762c2138ad03595215012fd0e49ddd#)","Benefits: Health, Dental, Life and AD&amp;D Insurance, Employee Wellness and 401k plans. Paid Time Off and Holidays with Generous Company Discounts .Emergency Reimbursement Benefits, Daily Hospital Benefit, Accidental Death Benefit, Travel Assistance",1
3147,Bilingual Retail Demonstrator,"US, CA, San Diego","Dyson demonstrators work part-time as members of the Field Sales team to engage consumers in an energetic and confident manner and provide them with knowledgeable information about Dyson products in select retail locations (i.e. Costco, Bed Bath andBeyond and Best Buy) or events across the United States. The most important part of a Demonstrators’ job is to create a positive experience with the store and the consumers; assisting in the sale of Dyson products to achieve company specified sales goals. Demonstrations occur on Saturdays, Sundays and some weekday holidays. Demonstrators must work a minimum of 3 out of 4 weekends per month within an assigned market. We are in need of bilingual (English &amp; Spanish) Demonstrators.Pay: $20.00/hr Duties and Responsibilities: •  Conduct planned demonstrations in assigned retail stores to achieve specified sales goals•  Capture consumers’ attention to participate in high energy, captivating in-store demonstrations and model all aspects of Dyson’s brand, culture, and passion for technology•  Be a credible product and brand expert by educating consumers on the benefits and features of Dyson products and actively listening to consumers to confidently recommend appropriate Dyson products and comfortably over objections•  Increase overall awareness and sales of Dyson products through in store and event demonstrations•  Actively monitor Dyson’s online reporting system to contribute quality feedback and report/confirm attendance","Opportunities for career growth.Competitive salaries.100% immediate vesting in our 401K pension plan including a 3% non-elective contribution by Dyson and a discretionary match on employee contributions.Bonus schemes.Paid vacation including one additional day earned every year, capped at 5 weeks in total.10 paid holidays, plus one floating holiday.Company paid life insurance.Health, vision and dental insurance.Extended child care and parental leave of absence policies.Very relaxed dress code.Company paid short term and long term disability.",1
3167,Earn Money Working From Home,"US, MA, Boston",Are you finding it harder to work for a boss?  Have you always wanted a better work / life balance?  Do you want to receive the reward you deserve for the effort you put in?  This is a fantastic opportunity that allows you to start part time or full time.The Opportunity Simple 3 Step SystemNo previous experience necessary because we will teach you how to use our proven systemEarn immediate incomeUnlimited income potentialHighly profitableWork from home in your own business Take the 5 minutes that will change your life.  For further information visit  #URL_1f2d6062a72b02d7dca177d36290abfea4fe46f991abe5b6e0c479e1ea72a163#,"By following our simple 3 step system, on a part time basis, you have the potential to earn an executive level income without the stress of corporate politics.  Our global organization experienced over 100% growth last year, with 2013 set for greater expansion.  Work from anywhere with simply your laptop and phone to earn extraordinary money, enjoy an interesting and professional occupation, all the while introducing the work/life balance you’ve always wanted.  Join an enthusiastic, growing team of people who have already achieved success with the system and who offer support.  Full training is provided and with ongoing professional development opportunities for successful applicants.",1
3176,Earn the Income You Deserve,"US, DC, Washington","Prepare yourself to learn about an exciting way to earn money without leaving your home using the time you have available. If you need to stay at home to care for kids or relatives then this is an opportunity to earn money during the hours of down time.  You can do all the work from home, you do not need to go out, and you can work the hours that are available to you. If you already have a job and are looking for extra income or are looking for a less stressful way to earn money then here is an opportunity to work from home outside of your work hours and earn a good return for the time you put in. Anyone can earn money in this business, what is needed is the consistency of putting in a few hours every day.  We teach you everything you need to know so no previous experience is necessary, we have many stay at home mums who are working their own businesses to help achieve their financial goals.  You have constant support available to you, all you have to do is follow 3 simple steps and we do the rest.  All you need is a computer with an internet connection and a phone. Find out more about this business and what it means for you.  Take the 5 minutes that will change your life by going to #URL_70d36ad73a432ff1597905ae0c50229fb00d4afa77dc734f024bea224a3f5495#","If you have a laptop, phone and a strong desire to achieve success in your life then this is the opportunity you have been looking for.",1
3180,Home Based Payroll Data Entry Clerk Position - Earn $100-$200 Daily,GB,"We are a full-service marketing and staffing firm, serving companies ranging from Fortune 100 to new start-up organizations. We work with job seekers in an equally broad range, from light industrial temporary workers to executive level candidates.Are you looking for a Work from Home Opportunity where you can earn up to $2500 and more per week? Our Online Service Representative position would be perfect for you!- Set your own hours - Make money every time you decide to work - Work remotely from home - Get paid weekly - If you have a computer with internet, this is for you","This is an entry level position and we offer full online training. You do NOT need any special skills to get started.Earn as much as you can doing data entry.  Complete Training provided before you start working and it’s easy to start!  ________________________________________Don’t let this opportunity pass you by.POSITIONS ARE STILL AVAILABLE - GET STARTED RIGHT NOWIf you fit the above description and meet the requirements, please apply stating your locationApply at: #EMAIL_3720fb437cf9ea0fba89dddcb596c3afd772be237f383163a3d18e00e4c65595#",1
3183,Home Based Payroll Data Entry Clerk Position - Earn $100-$200 Daily,"US, MS, Abbeville  ","We are a full-service marketing and staffing firm, serving companies ranging from Fortune 100 to new start-up organizations. We work with job seekers in an equally broad range, from light industrial temporary workers to executive level candidates.Are you looking for a Work from Home Opportunity where you can earn up to $2500 and more per week? Our Online Service Representative position would be perfect for you!- Set your own hours - Make money every time you decide to work - Work remotely from home - Get paid weekly - If you have a computer with internet, this is for you","This is an entry level position and we offer full online training. You do NOT need any special skills to get started.Earn as much as you can doing data entry.  Complete Training provided before you start working and it’s easy to start!  ________________________________________Don’t let this opportunity pass you by.POSITIONS ARE STILL AVAILABLE - GET STARTED RIGHT NOWIf you fit the above description and meet the requirements, please apply stating your locationApply at: #EMAIL_3720fb437cf9ea0fba89dddcb596c3afd772be237f383163a3d18e00e4c65595#",1
3186,Payroll Data Coordinator Positions - Earn $100-$200 Daily,"US, KS, Abbyville ","We are a full-service marketing and staffing firm, serving companies ranging from Fortune 100 to new start-up organizations. We work with job seekers in an equally broad range, from light industrial temporary workers to executive level candidates.Are you looking for a Work from Home Opportunity where you can earn up to $2500 and more per week? Our Online Service Representative position would be perfect for you!- Set your own hours - Make money every time you decide to work - Work remotely from home - Get paid weekly - If you have a computer with internet, this is for you","This is an entry level position and we offer full online training. You do NOT need any special skills to get started.Earn as much as you can doing data entry.  Complete Training provided before you start working and it’s easy to start!  ________________________________________Don’t let this opportunity pass you by.POSITIONS ARE STILL AVAILABLE - GET STARTED RIGHT NOWIf you fit the above description and meet the requirements, please apply stating your locationApply at: #EMAIL_c9b5d8a60f3d80be13dd02ffe5d212c047b92ba679c296dfae7c102952fbb534#",1
3190,Payroll Data Coordinator Positions - Earn $100-$200 Daily,"US, NC, Aberdeen ","We are a full-service marketing and staffing firm, serving companies ranging from Fortune 100 to new start-up organizations. We work with job seekers in an equally broad range, from light industrial temporary workers to executive level candidates.Are you looking for a Work from Home Opportunity where you can earn up to $2500 and more per week? Our Online Service Representative position would be perfect for you!- Set your own hours - Make money every time you decide to work - Work remotely from home - Get paid weekly - If you have a computer with internet, this is for you","This is an entry level position and we offer full online training. You do NOT need any special skills to get started.Earn as much as you can doing data entry.  Complete Training provided before you start working and it’s easy to start!  ________________________________________Don’t let this opportunity pass you by.POSITIONS ARE STILL AVAILABLE - GET STARTED RIGHT NOWIf you fit the above description and meet the requirements, please apply stating your locationApply at: #EMAIL_c9b5d8a60f3d80be13dd02ffe5d212c047b92ba679c296dfae7c102952fbb534#",1
3191,Payroll Data Coordinator Positions - Earn $100-$200 Daily,"US, ND, Abercrombie ","We are a full-service marketing and staffing firm, serving companies ranging from Fortune 100 to new start-up organizations. We work with job seekers in an equally broad range, from light industrial temporary workers to executive level candidates.Are you looking for a Work from Home Opportunity where you can earn up to $2500 and more per week? Our Online Service Representative position would be perfect for you!- Set your own hours - Make money every time you decide to work - Work remotely from home - Get paid weekly - If you have a computer with internet, this is for you","This is an entry level position and we offer full online training. You do NOT need any special skills to get started.Earn as much as you can doing data entry.  Complete Training provided before you start working and it’s easy to start!  ________________________________________Don’t let this opportunity pass you by.POSITIONS ARE STILL AVAILABLE - GET STARTED RIGHT NOWIf you fit the above description and meet the requirements, please apply stating your locationApply at: #EMAIL_c9b5d8a60f3d80be13dd02ffe5d212c047b92ba679c296dfae7c102952fbb534#",1
3195,Home Based Payroll Typist/Data Entry Clerks Positions Available,"US, AL, Abernant ","We have several openings available in this area earning $1000.00-$2500.00 per week. We are seeking only honest, self-motivated people with a desire to work in the home typing and data entry field, from the comfort of their own homes.The preferred applicants should be at least 18 years old with Internet access. No experience is needed. However the following skills are desirable:  ",All you need is access to the Internet and you can participate. This is an entry level position and we offer full online training. You do NOT need any special skills to get started.Earn as much as you can from the comfort of your home typing and doing data entry.  Complete Training provided before you start working and it’s easy to start!  ________________________________________Don’t let this opportunity pass you by.POSITIONS ARE STILL AVAILABLE - GET STARTED RIGHT NOWApply at: #EMAIL_c9b5d8a60f3d80be13dd02ffe5d212c047b92ba679c296dfae7c102952fbb534#,1
3199,Home Based Payroll Typist/Data Entry Clerks Positions Available,"US, MD, Accident ","We have several openings available in this area earning $1000.00-$2500.00 per week. We are seeking only honest, self-motivated people with a desire to work in the home typing and data entry field, from the comfort of their own homes.The preferred applicants should be at least 18 years old with Internet access. No experience is needed. However the following skills are desirable:  ",All you need is access to the Internet and you can participate. This is an entry level position and we offer full online training. You do NOT need any special skills to get started.Earn as much as you can from the comfort of your home typing and doing data entry.  Complete Training provided before you start working and it’s easy to start!  ________________________________________Don’t let this opportunity pass you by.POSITIONS ARE STILL AVAILABLE - GET STARTED RIGHT NOWApply at: #EMAIL_c9b5d8a60f3d80be13dd02ffe5d212c047b92ba679c296dfae7c102952fbb534#,1
3231,Info Tech Personnel,"US, OH, Cincinnati","We're hiring for  Design Specialists, Web Developers, Technical Solutions Implementor, and Technical Support Analyst. At this level you report to your director of Information and Technology. ","The current, standard company health, life, disability vision, and dental insurance coverage are offered with this agreement per company policy. Your eligibility for other benefits, including the 401(k) and bonus potential will take place per company policy. The company benefit offerings and employee contribution to payment for benefit plans are determined annually. As an employee of Bradley Contracting Group Corporation, you will receive nine paid holidays, determined annually by the company. You are eligible to accrue vacation time off at one week per year. Vacation time off increases per company policy. Personal days are accrued at x.xx per pay period, per company policy, and total seven days annually. All employee benefits are subject to periodic company review and can be changed with or without notice.",1
