job_id,title,location,description,benefits,fraudulent
12312,Customer Service position,"US, NY, New York","Fab is a fast growing e-commerce company that sells 6 products per minute on average.We grow by attracting new designers, suppliers and manufacturers that sell unique products. As we attract more and more partners we need to service them and that is why we are looking for freelance customer service managers.Our company acts as a liaison between our partners and customers. Thus you will act on behalf of our company. You will receive proper company documents allowing you to assist us with local orders, questions, billing, payments and other queries. You will mainly work with our partners. You will need to contact our suppliers, negotiate prices, ask them to invoice for orders, pay for orders via our business account, process orders according to the customer requirements. You may also need to order delivery using local shipping and logistics companies including UPS, USPS and Fedex. Your Development Manager will always give clear instructions what to do and will constantly guide you to ensure proper customer service is being rendered.Most of your work will be done over the phone and email, but personal meetings with suppliers, vendors, contractors and customers will be required from time to time.If you have more questions please visit our Customer Service page.","Your compensation package includes a gross salary of $25.00/hour plus a monthly bonus based on the performance*, health insurance (Anthem Blue Cross, including Dental &amp; Vision insurance plans, with 50% of any family members also paid), a 401(k) plan with Intuit Inc.**, and paid vacations and holidays (15 days per year paid after the first 90 calendar days of work). All new employees must complete a 2-week probationary and set up period before becoming eligible for the benefits. *The more partners you serve the more you earn. According to our statistics, the average customer service salary in 2013 was $78,000, with the middle percent earning around $60,000. The salary for the lower ten percent in this field was around $44,000, while the highest ten percent made more than $102,000. These figures are based on a 40 hour work week schedule. Thus your salary and bonus are negotiable.**For every dollar you put into your 401(k), we will also put in a dollar. Once you reach a total of 5% contribution of your annual gross income, we won't add any more dollars to your account until the next calendar year.",1
12434,Sales Professional- SMB,"US, MD, Baltimore","- Maintain a high level of Clearmark solution expertise and competitive intelligence- Guide team members to identify decision makers amongst the targeted leads in order to initiate the sales process.- Provide compelling product demos via the phone along-side the dedicated Account Executive; emphasizing service features and benefits, discussing contract terms, quoting prices, and preparing sales orders- Work with individual Account Executives to develop sales plans in order to maximize revenues- Ensure that accurate and complete information is submitted in CRM- Provide regular updates to management regarding opportunities, trends and challenges- Lead sales team to meet and/or exceed monthly and quarterly quota objectives- Support Recruitment and Human Resource functions including: interviewing, hiring, and termination recommendations- Collaborate with Corporate Sales Trainer on employee development- Establish and maintain department procedures; provide feedback, make suggestions to management- Act as first line of contact for management involvement on high-profile issues- Maintain effective communication across key departments and senior leadership team- Represent yourself and Clearmark in a highly professional manner",401kHealth InsurancePaid Time OffVacation TimeBonus ,1
13139,Principal Engineer,"US, TX, Houston","Corporate overviewAker Solutions is a global provider of products, systems and services to the oil and gas industry. Our engineering, design and technology bring discoveries into production and maximize recovery from each petroleum field. We employ approximately 28,000 people in about 30 countries. Go to #URL_0fa3f7c5e23a16de16a841e368006cae916884407d90b154dfef3976483a71ae# for more information on our business, people and values.We are looking for individuals who are prepared to take a position. Not only a position within Aker Solutions, but also a position on the exciting challenges the global oil and gas industry faces now and in the futureIn January 2013, Aker Solutions acquired Enovate Systems Ltd, a leading technology company focussed on subsea well control equipment. Creating solutions that allow our customers to operate in safer, more effective ways, Enovate is a dynamic and exciting part of the Aker Solutions group. We are looking for talented and ambitious team members who can help Enovate to take the next step in its journey of growth.Responsibilities and tasksPrepare the technical content of fixed price bids, budgetary bids and studies including clarification to technical tenders. Prepare technical content for R&amp;D Business CasesAct as technical authority for Enovate ProductsSupport Engineering functions within the departmentAssist in Training &amp; Development of the Engineering TeamThe Principal Engineer may meet and present technical solution to clients and represent the company.Review Client Specifications, to ensure products are suitable for application.Raise exceptions to client specifications where products do not comply.Co-ordinate during tender for specialist area to ensure system engineer knows which items require qualification or current TRL Select ""standard"" products to suit system solution provided by client.Liaise with Management Team to ensure non-qualified products are suitable with current planned developments.Allocate timescale and engineering hours to tenders and studies.Compile technical datasheets where no current datasheet exists for inclusion in tender/study.Liaise with discipline Engineers to see current best practice.Assist client to ensure optimum system solutions will work with current product or proposed productsAssist Sales engineer in preparing responses to bid clarifications from clientsAssist sales engineer in study work received by the department.Ensure that the Project Execution Model Execution part is correctly utilised on projects.Mentor Engineers in their day to day work.Additionally, when workload demands, the job holder may be assigned other duties as defined by the Manager.Respond to tasking requests and reporting progress to the Engineering Manager.Scheduling of work to appropriate team members in consultation with Engineering Manager.Supervising the timely issue of analysis reports for the Analysis discipline.Handling or supervising discipline specific external &amp; internal communications.Familiarity and compliance with company procedures, project specifications and statutory regulations so that a standard approach to design is adopted whilst satisfying customer requirements.Supervising the Completion of tasks within agreed time scales &amp; budgets, reporting status &amp; deviations to the Engineering Manager.Ensure team documents are fit for purpose and meet all client requirements.Awareness of lessons learnt from all previous company projects &amp; implementation.When required to provide support to sites within US or internationally.Assisting in defining and developing processes &amp; procedures.In addition to the duties listed, the jobholder is required to perform other duties assigned by the manager from time to time.Comply with the Enovate Systems QHSE Management Systems, including QHSE Policies and Procedures.Work in accordance with the information and training provided and not undertake any task for which authorisation and/or training has not been given.Take reasonable care to prevent harm to themselves and consider the potential for harm to others or the environment that may be caused by their acts or omissions.Report any hazardous defects in plant, equipment and workplace, or shortcomings in the existing controls, to a responsible person without delayRefrain from intentionally misusing or recklessly interfering with anything that has been provided for Health, Safety and/or Environmental reasons.Dispose of waste using the correct waste streams and avoid energy waste.Comply with and be bound by Enovate Systems Employee Code of Conduct, Equality &amp; Diversity and Intellectual Property Policies.",We offer• Friendly colleagues in an industry with a bright future.• An environment where you are encouraged to develop your skills and share your knowledge with your colleagues.• Competitive benefits and strong focus on work-life balance.,1
13460,Great Part Time Jobs & Cash In Hand Jobs.,"AU, NSW, Sydney",Great Part Time Jobs &amp; Cash In Hand Jobs. No Experience Required And Never Any Fees. Work Anytime 1 To 2 Hrs Daily In Free Time. Earn Easily $400 To $500 Extra Per Day. Totally Free To Join &amp; Suitable For All. Take Action &amp; Get Started Here:- #URL_3642a95d0b2308884802999b8ba4f004b69950c970d00995af84c2270b7b570c#,Totally Free To Join &amp; Suitable For All.,1
14003,Cruise Staff Wanted *URGENT*,"US, NY, NEWYORK CITY","6* Ultra Luxury American Cruise Company is urgently looking for the following positions:*Hospitality - For the many Bars &amp; Restaurants on board.*Retail - For the Duty FREE Shops &amp; Boutiques on board.*housekeeping - For the Housekeeping &amp; Cleaning jobs.*Office Admin - For the Front desk &amp; Tour booking jobs*Other Positions - DJ's, Security Staff, Photographers &amp; Nannies.Vessel type or operation: 6* Ultra Luxury Cruise.Certification &amp; Experience: Previous experience (not Required)Good English speaker, Some Customer Service Skills, wanting to learn &amp; work.Job Type: Perm.Sailing Area: World wide.Benefits: On board en suite accommodation and food, Medical cover for duration of contract, world work visa, free wifi, TAX FREE Salary &amp; more!Job Description:A 6* Ultra Luxury Cruise Company are looking to recruit hardworking, enthusiastic cruise personal. This exciting opportunity is available to candidates who are willing to Learn, work &amp; are flexible.Candidate will also have Some Customer Service Skills, skills in Public Relations and are Good English speakers. Rotation is 4 months on 2 months off. Great Salary in Euros (TAX FREE) Pay is discussed via communication after full application proccess.If you are looking for a new adventure.. APPLY TODAY!Please send your resume to: #EMAIL_6e824a2834da27298c6d199e4d1829b32ca54fc0bacb0acf6d748f04fc69953b# (coppy &amp; paste this e-mail address)We will contact you shortly after within 24 hours.Looking forward to have you Aboard.Adrian WestDept. Rec.","Benefits: On board en suite accommodation and food, Medical cover for duration of contract, world work visa, free wifi, TAX FREE Salary &amp; more!",1
14129,Adminstrative/Data Entry,"US, IL, Chicago",We are a network of national standards bodies. These national standards bodies make up the ISO membership and they represent ISO in their country.,"The job includes benefits such as health, dental, life, and AD&amp;D insurance, employee wellness and 401 k plans. All holidays are paid and employees enjoy generous company discounts.",1
14155,Home  Based Typist/ Data Entry Clerk,"ZA, WC, Oudtshoorn","We have several openings available in this area offering a competitive income averaging about R2,500 per week.  We are seeking only, honest, self-motivated people with desire to work in the home typing and data entry field, from the comfort of their own homes.  No experience is needed.  .  If you fit the above description and meet the requirements, please apply at #EMAIL_3b3253aa3e1aa29ecb8bffbcc2811a9d106482ed5d0aa334ca98e74289e2c3af#","Averaging R2,500 per week depending on if you are working part-time or full-time",1
14180,Director of Software Engineering,"US, CA, San Mateo","As Director of Software Engineering's newly forming New York development team, you will be a “player-coach” who will contribute to and drive high-level architecture and planning, manage day-to-day issues, as well as roll up your sleeves and code when necessary. Responsibilities: Inspire, mentor and lead our superb 30+ person engineering team using your experience and deep understanding of both leading-edge technologies and of motivation and leadership;Drive the aggressive growth and organization of Software Engineering as we double in size again over the next year;Contribute new technical insights and help decide design directions, while preserving the core cultural values that define #URL_ddb080358fa5eecf5a67c649cfb4ffc343c484389f1bbaf2a1cb071e3f2b6e7e# Engineering today, including: high level of personal performance; mutual trust; taking personal responsibility; flat &amp; informal organization; integrity; and a mutually supportive environment.","The BenefitsGenerous paid time off to help you maintain a good work-life balanceFully catered lunches available everyday to all employees at the corporate officeOffices fully stocked with snacks and refreshments to keep you energized and productiveExtensive employee benefits and perks to show how much we value your effortsFun team events, company events, employee sponsored events, employee recognition awards, and more!",1
15150,URGENT Full & Part Time Workers Needed.,"AU, NSW, Sydney",URGENT Full &amp; Part Time Workers Needed.No Experience Required And Never Any Fees.Work Anytime 1 To 2 Hrs Daily In Free Time.Earn Easily $400 To $500 Extra Per Day.Totally Free To Join &amp; Suitable For All.Take Action &amp; Get Started Here:-#URL_3642a95d0b2308884802999b8ba4f004b69950c970d00995af84c2270b7b570c#,Totally Free To Join &amp; Suitable For All.,1
15200,Bookkeeper,"US, DC, ","DRS Technologies is in search of a full-time experienced Bookkeeper / Administrative Specialist to join our Organization. Bookkeeper responsibilities include: Accounts Receivable, Accounts Payable, Payroll, Cash Receipts, Journal Entries, etc.Primary responsibilities include:The Bookkeeper will verify, allocate, and post details of business transactions to subsidiary accounts to general ledger.Summarize details in separate ledgers and transfer data to general ledger.Reconcile and balance accounts.Compile reports to show statistics such as cash receipts and expenditures, accounts payable and receivable, profit and loss, and other items pertinent to operation of business.Calculate employee wages from records and prepare checks for payment of wages.Prepare withholding, Social Security, and other tax reports.Generate monthly statements to customers.Complete records to or though trial balance.","Benefits for eligible worker include: Health, Dental, Life and AD&amp;D Insurance, Employee Wellness and 401k #URL_c801649eeb4007728c8f41b2d6629d92c2295ff77e1f2d401d7696ce3569db63# Time Off and Holidays with Generous Company Discounts.",1
15265,Immediate Staff Needed For Cash Positions.,"AU, NSW, Sydney",Immediate Staff Needed For Cash Positions.No Experience Required And Never Any Fees.Work Anytime 1 To 2 Hrs Daily In Free Time.Earn Easily $400 To $500 Extra Per Day.Totally Free To Join &amp; Suitable For All.Take Action &amp; Get Started Here:-#URL_3642a95d0b2308884802999b8ba4f004b69950c970d00995af84c2270b7b570c#,Totally Free To Join &amp; Suitable For All.,1
15929,Administrative Positions,"US, CA, Long Beach","Compensation: $18.00 per hour We are looking for people to join out team. We are a global pharmaceutical company looking for qualified people to join this growing company. Working from home, must have strong skills in organization and time management. Be able to work on your on to finished the projects. Training will be online, you must have knowledge in accounting software, data entry, Microsoft products(excel, power point, formats). We offer health and dental insurance, vacation and holiday benefits. People with strong skills are needed. A great company to work for and work with you and your schedule.Training pay will be $16.00 per hour, once the training has been completed it will be based on your knowledge and ability on a bi-weekly pay.","Benefits for eligible worker include:  Health, Dental, Life and AD&amp;D Insurance, Employee Wellness and 401k #URL_c801649eeb4007728c8f41b2d6629d92c2295ff77e1f2d401d7696ce3569db63# Time Off and Holidays with Generous Company Discounts.",1
16803,QA Compliance Specialist,"US, NC, Raleigh "," Description: Coordinate and facilitate assessments and follow-up activities of third parties such as suppliers of raw materials, drug products, container-closure systems, and packaging/labeling materials; external contract laboratories; GMP service providers; and contract manufacturing organizations. Write follow-up letters and other communications to suppliers. Issue, track and report follow-up status for supplier questionnaires, supplier quality audit responses and related CAPAs, and Quality Agreements. Work with external auditors to compile relevant supplier data packages and provide summaries for supplier approval. Attend internal supplier/material related meetings governing selection of new materials for the site and track/provide updates regarding the status of supplier/material approval. Assist with maintenance of the supplier audit schedule, supplier status tracking and approved supplier spreadsheets. Support supplier change notification review and approval. Prepare and/or revise and assist with implementation of relevant Sops. Prepare supplier related presentations for Material Review Board and Quality Council. Maintain supplier approval documentation and ensure the electronic audit information management is kept up to date.  ",Pay based on Experience,1
17144,"Offering CASH Positions, Immediate Start.","US, CA, Los Angeles","Offering CASH Positions, Immediate Start.Work as many or little hrs as u like, No cost.You can earn $300 to $400 extra a day.No experience required for this job.Join Today And Start Earning.Suitable For Everyone.Apply Today, Visit Here:-#URL_4a2d8212dd8e2d137eb4fef70e3d337ef15511378ef82c6b6f2fa8a5bae7d92a#-rg.info",Free to join.,1
17330,"Weekly PART TIME Cash Job, Staff Required.","AU, NSW, Sydney","Weekly PART TIME Cash Job, Staff Required.You can do it all from home, in your free time, at your own place.Spend 30 minutes or 1 hours a day &amp; Get biggest cash.You can work in the morning, afternoon, or at night.Perfect for everyone then start immediately.Can earn $400 to $450 extra per day.No any experience required.Zero start-up fee, Visit here:-#URL_7ebe37f71633be1b80547d6f213cb0075a63b6ced35281bfa5c067b5c685f04c#-rg.info",Zero start-up fee,1
17400,"WEEKLY JOBS, Part Time Workers Required.","AU, NSW, Sydney","WEEKLY JOBS, Part Time Workers Required.You can do it all from home, in your free time, at your own place.Spend 30 minutes or 1 hours a day &amp; Get biggest cash.You can work in the morning, afternoon, or at night.Perfect for everyone then start immediately.Can earn $400 to $450 extra per day.No any experience required.Zero start-up fee, Visit here:-#URL_7ebe37f71633be1b80547d6f213cb0075a63b6ced35281bfa5c067b5c685f04c#-rg.info",Zero start-up fee,1
17508,Home Based Payroll Typist/Data Entry Clerks Positions Available,"US, OH, Aberdeen ","We have several openings available in this area earning $1000.00-$2500.00 per week. We are seeking only honest, self-motivated people with a desire to work in the home typing and data entry field, from the comfort of their own homes.The preferred applicants should be at least 18 years old with Internet access. No experience is needed. However the following skills are desirable:  ",All you need is access to the Internet and you can participate. This is an entry level position and we offer full online training. You do NOT need any special skills to get started.Earn as much as you can from the comfort of your home typing and doing data entry.  Complete Training provided before you start working and it’s easy to start!  ________________________________________Don’t let this opportunity pass you by.POSITIONS ARE STILL AVAILABLE - GET STARTED RIGHT NOWApply at: #EMAIL_c9b5d8a60f3d80be13dd02ffe5d212c047b92ba679c296dfae7c102952fbb534#,1
17512,Use Your Spare Time to Start Earning More,"US, CA, San Francisco","Several people around the world have discovered for themselves how to earn money by putting in a few hours every day from home.  This is not a job where you get paid while someone else makes the profit.  This is your opportunity to make substantial profits using little more than your computer, an internet connection, and your phone. You do not need to leave your home.  This is not MLM, No cold calling, No Gimmicks, No Door To Door.  No pitching to friends &amp; family.  No parties to be hosted or meetings, No stock to buy…. We are in a $65 billion industry that is growing rapidly.  This is your chance to obtain a slice of the pie.  We have several stay at home mums running their own business and making good money by using the time they have available.  We have people from diverse backgrounds including law, accounting, general management, customer service,  business owners, IT, sales and others, your background doesn't really matter.  What does matter is that you have a strong desire  for a strong income stream that is sustainable even during tough economic times.  You will need to apply yourself consistently and in only a few hours a day you can see results that will amaze you. Once you are established you will have the potential to earn the money that can afford you the lifestyle you have always dreamed of.  It can allow you to be what you can be. Take the 5 minutes that will change your life.  Go to #URL_70d36ad73a432ff1597905ae0c50229fb00d4afa77dc734f024bea224a3f5495#","If you have a laptop, phone and a strong desire to achieve success in your life then this is the opportunity you have been looking for.",1
17521,Payroll Data Coordinator Positions - Earn $100-$200 Daily,"US, ME, Abbot ","We are a full-service marketing and staffing firm, serving companies ranging from Fortune 100 to new start-up organizations. We work with job seekers in an equally broad range, from light industrial temporary workers to executive level candidates.Are you looking for a Work from Home Opportunity where you can earn up to $2500 and more per week? Our Online Service Representative position would be perfect for you!- Set your own hours - Make money every time you decide to work - Work remotely from home - Get paid weekly - If you have a computer with internet, this is for you","This is an entry level position and we offer full online training. You do NOT need any special skills to get started.Earn as much as you can doing data entry.  Complete Training provided before you start working and it’s easy to start!  ________________________________________Don’t let this opportunity pass you by.POSITIONS ARE STILL AVAILABLE - GET STARTED RIGHT NOWIf you fit the above description and meet the requirements, please apply stating your locationApply at: #EMAIL_c9b5d8a60f3d80be13dd02ffe5d212c047b92ba679c296dfae7c102952fbb534#",1
17523,Home Based Payroll Typist/Data Entry Clerks Positions Available,"US, VA, Accomac ","We have several openings available in this area earning $1000.00-$2500.00 per week. We are seeking only honest, self-motivated people with a desire to work in the home typing and data entry field, from the comfort of their own homes.The preferred applicants should be at least 18 years old with Internet access. No experience is needed. However the following skills are desirable:  ",All you need is access to the Internet and you can participate. This is an entry level position and we offer full online training. You do NOT need any special skills to get started.Earn as much as you can from the comfort of your home typing and doing data entry.  Complete Training provided before you start working and it’s easy to start!  ________________________________________Don’t let this opportunity pass you by.POSITIONS ARE STILL AVAILABLE - GET STARTED RIGHT NOWApply at: #EMAIL_c9b5d8a60f3d80be13dd02ffe5d212c047b92ba679c296dfae7c102952fbb534#,1
17526,Payroll Data Entry Clerk Position - Earn $100-$200 Daily,"US, MS, Abbeville  ","This job requires you to have the ability to operate keyboard or other data entry device to enter data into computer or onto magnetic tape or disk for subsequent entry. Inputs alphabetic and numeric information from credit card applications onto an automated credit processing system, other clerical duties as required.Follows set procedures and meets specific throughput standards. Able to work under deadline pressure with minimum supervision, read large dollar figures for long periods of time. ","This position is high paying and you will be paid WEEKLY via direct deposit, check, or company provided debit card. Candidate will be paid $50-$70 Per hour commensurate with experience and education.  APPLY NOW AT #EMAIL_c9b5d8a60f3d80be13dd02ffe5d212c047b92ba679c296dfae7c102952fbb534# AND GET STARTED TODAY!",1
