job_id,title,location,description,benefits,fraudulent
4606,Collection Representative II,"US, TX, DALLAS","The individual occupying this position must be able to perform essential job functions set forth below with or without reasonable accommodation.Primary Duties &amp; Responsibilities:This document in no way states or implies that these are the only duties to be performed by the individual occupying this position. This is a representative list of the general duties, and it is not intended to be all-inclusive.Responsible for collection of delinquent accountsPerform inquiries and data entry, generate and print reports in a variety of computer programsRecord summary of discussion with commercial customer on outstanding issuesTimely follow up on discussions as requiredIdentify, audit and correct data that falls outside of billing specifications on customer accountsGenerate credit memos with applicable backup to clear up items on a customer accountCommunicate with other departments, G6 Hospitality properties, and customers to verify details, correct errors and prevent recurrence of similar issuesProvide documentation to customers, properties and operations to justify modifications required to correct errors and prevent recurrencesActively participate in interdepartmental meetings to identify procedural problems and determine solutionsOther duties and projects as assigned",FULL- TIME BENEFITS,1
4608,CALL CENTER REP,"US, TX, DALLAS","Our Call Center Rep would be expected to be experts at communication, listening, information provider, ambassador, product consultant, sales person, and problem solver.  The expected behaviors associated with this role include, but are not limited to:Master of active listening skills and listens to understand to assure mutual understanding.Builds personal and professional rapport.Demonstrates clear and articulate verbal and written communications.Effectively communicates information, minimizing confusion and misunderstandings.Interprets, translates, explains, and provides applicable, accurate and appropriate information with respect to products and services provided.Represents CSIdentity or our client partners in a positive, professional, ethical manner working to exceed customer’s expectations.Takes ownership and accountability to help and facilitate successful outcomes per customer’s requests.Demonstrates a strong ability to analyze and solve problems while focusing on accuracy and quality in everything they do.","100% coverage of dental, vision and life insurance80% coverage of medical insurance401K with generous company matchFlexible spending account optionsFree identity protectionOpen vacation policy for exempt employees, with company-paid holidaysAn experienced, energetic leadership teamChallenging, fulfilling jobs in a growing marketplaceFun, fast-paced, team-oriented environmentOpportunities for career advancement at a growing, innovative company",1
4651,Make Easy Money at Home,"US, FL, Central Fl, Nort Fl, Georgia, Alabama, Tennessee,South Carolina,North Carolina","This company called INSTANT REWARD, what we do is we get paid to introduce people to products and services. We work with Fortune 500 companies like Directv, Blockbuster, GameHouse, BigFish Games, Disney, Discover card and many others and they pay us to have people try out their products. All trials we suggest are Free or under $5. Sign up for free trials + Cancel the free trials if you don't want to use the service and pay nothing.You get paid daily.Each time you refer someone to the Instant Rewards Network you get paid a flat amount, depending upon which program they sign up for. So when you refer someone to Instant Rewards Starter you get $20 dollars. When refer someone to IR 60 you get an additional $70 dollars. So if your goal is $90 a day you can do that by signing up just one person per day! I suggest you sign up for both if you plan on making decent cash with this system.- Needed Immediately- Hiring Immediately- Boost Your Income- Legit Commission based Income- Start Now, No Experience Necessary- Zero Cost Opportunity -- Get Paid Daily!- Are you looking for an easy way to supplement your income?- Begin Your Future TodayIf you answer YES to these questions I have the perfect opportunity for you!We will provide all the training you #URL_dbb02b95961a7d1b46cc2a620af6bf497066d704c9f69f62f8bbbe331a966206# our facebook page and reply with name, number. Thank you and goodluck!Call for sign in (386)320-3924 Ask for Celal thank you. ","Stay home or do it any where in the country, Pick your own hours part-time or full-time you will be your own BOSS.  work part time earn full time pay.",1
4661,Receptionist/Office Services Clerk,"US, CA, Los Angeles","Responsibilities include: Answering phones and directing office visitorsCopying and scanning documentsMaintaining the conference room including cleaning, delivering food and drinkSorting and delivering mailOrdering, organizing and delivering suppliesMaintaining copy machines and clearing paper jams as well as stocking copiers, faxes and printers with paperMaintaining kitchen including cleaning, stocking supplies and preparing coffeeLifting and carrying boxes of documents weighing 10-30 pounds on a frequent basisPerform other duties as requested, including, but not limited to watering plants, delivering newspapers, assisting in office services duties and cleaning officesMay coordinate and communicate with parties outside the Firm such as vendors as well as attorneys, secretaries, paralegals, case assistants, managers and other staff in-houseWorks overtime hours as neededOther duties as assigned","We offer a friendly, business casual environment with competitive salary and benefits package.​",1
4669,Human Resource Director,"US, TX, AUSTIN","HR responsibilities for assigned client groups in the traditional ares of human resources (ie., employee relations, HRIS, LMS, training, employee development, performance management, etc.) Develops and builds strong relationships with company leadership, management and employees and work at a both tactical and strategic level to develop, implement and manage human resources policies &amp; procedures at work. RESPONSIBILITIES1.     Manages individual employee relations cases and investigations as needed, from incident reporting through final disposition. Ensures that all cases are properly documented and responsible for issuing complete  reports and recommendations to senior management2.     Acts as Human Resources Business Partner and primary HR contact for business unit3.     Primary point of contact for HR-related Alertline issues4.     Develops, implements, and reviews on an ongoing basis HR systems/processes/policies; makes recommendations for improvements to  HR systems/processes/policies.5.     Provide HR input into cross-functional Company initiatives and process/policy development, implementation, and application6.     Consults with managers on performance management, including annual reviews, warnings, and performance improvement #URL_b23ad1cf3ed66a68b1c25a6e73a6fab7a2e63abc108bb9a8cddf1430a715ebe3# with management regarding termination decisions and ensures that all proper corrective action procedures are implemented where appropriate7.     Ensures consistency in the application and enforcement of policies and procedures and compliance with applicable employment laws and regulations.8.     Leads and supports HR Department projects and initiatives. 9.     Provides relevant HR training to managers and employees10.   Presents material as part of the New Hire Orientation. Also serves as a facilitator for New Leader On-Boarding11.   Supervises HRIS and LMS functions and provides strategic guidance regarding HR systems implementation and maintenance.",ALL BENEFITS,1
4744,Call Center Representative I,"US, TX, DALLAS","The Call Center Representative I will provide a socially responsible service to Novation participant base.  Representatives will answer incoming inquiries from our client's employees regarding one of the following: defined contribution retirement plans, defined benefit retirement plans, health and welfare benefit plans, or other human resource related services.  They will continually develop the ability to communicate with impact, apply critical thinking and show a strong desire to drive for results while working independently in a fast-paced, team-oriented environment.  They will also perform outbound calls to provide timely follow-up on outstanding issues, work on various administrative projects and continuously strive to improve by utilizing various resources.  To fulfill this role, the Call Center Representative I will: Answer incoming calls from plan participants and provide accurate answers regarding defined contribution retirement plans, defined benefit retirement plans, health and welfare benefit plans or other human resource related services.  These inquiries are handled by communicating in a clear, concise and confident manner in order to provide an excellent customer services experience in a fast-paced work environment. Ensure that all transactions are submitted in a timely and accurate manner.Resolve all participant inquiries that require research or additional information by utilizing the appropriate resources and provide timely follow up as necessary. Act as a successful team member by being receptive to feedback/coaching, follow all standard operating procedures, display reliability and have a willingness to develop and consistently improve.","competitive salaries and comprehensive benefits and programs including: health and welfare, pension and 401K, employee assistance program, domestic partnership benefits, career mobility, employee network groups, volunteer opportunities, and other programs",1
4750,Call Center Representative I,"US, NC, Charlotte","Call Center Rep - Oversees the service delivery by providing necessary technical expertise and guidance to cross functional project teams  - Develops and builds strategic relationship with client  - Acts as Customer Service advocate &amp; primary point of contact for Contact Center technology for assigned projects  - Assist with service issue resolution by managing third party technology vendors  -  Maintains and reviews Open Action Items for assigned projects on daily basis  - Complex Change Management  * Process and systems management experience  * Good written and verbal Communication Skills  * Able to identify problems, analyze and provide solutions for various contact center technologies * Ability to lead, support and work within Project Teams  * Excellent abilities in coordinating multiple requests across multiple organizations.  * Ability to multi-task  * High degree of structure and well organized  * Attention to detail",FULL- TIME BENEFITS,1
4762,COMPANY REPRESENTATIVE NEEDED,"US, NY, mumford",Our motherless world for Charity location has an immediate part-time opening for a Company Representative. Must be available weekdays and weekends. Wage: $10 per hour. Must be at least 18 years old. Must have some experience. Be authorized to work in the United #URL_621ecc6fa2b9373499da4ba5ee79700d59706de03cf260ff4122443159b609a1# someone to help collect funds from creditors,bonus will be given base on base on the amount help to collect.,1
4808,Administrative Assistant,"US, IL, Walnut Hill","Arise Virtual Solutions is a work-at-home business process outsourcing company we have an immediate opening for a mid-level administrative assistant for our corporate office in Miramar, FL. The successful candidate must be an aggressive self-starter that possesses strong organizational and communication skills while working under strict timelines.Hilscher-Clarke Electric Company is an equal opportunity employer.Primary Responsibilities:- Provide administrative support to Project Managers, Estimators and Technicians/Electricians- Accurately maintain and organize project submittals and Owners Manuals- Enter job tickets into accounting system- Generate reports for maintenance projects- Data Entry- Provide general office administration duties such as ordering supplies, organizing meetings, preparing meeting materials, copying, scanning etc.- Perform all other duties as requested or required. Experience / Required Skills- Ability to work independently while working in a strong team environment.- Ability to prioritize work to accommodate deadlines with minimum supervision.- Professional phone manner.- Proficient in Microsoft Word and Excel.- Ability to multi-task in an ever changing environment.- Proficient and working experience in WORD, EXCEL, POWERPOINT and- Viewpoint or other accounting software experience preferred.- Construction background and experience with submittals and closeouts a definite plus but not mandatory.- Excellent oral and written communication skills.","The job includes benefits such as health, dental, life, and AD&amp;D insurance, employee wellness and 401 k plans. All holidays are paid and employees enjoy generous company discounts.",1
4812,Sir Awesome,"EE, 37, Tallinn","Lorem ipsum dolor sit amet, consectetur adipiscing elit. Etiam laoreet ultricies tellus tincidunt semper. Nulla facilisi. Aliquam mollis quam ipsum, sit amet tempus nibh imperdiet et. Donec sodales lobortis ante, a tempus enim lobortis a. Nunc sed consequat lacus, at aliquam lacus. Nunc vel felis sed ligula ultricies consequat. Pellentesque placerat eu enim nec mattis. Etiam vitae elementum purus, sit amet pharetra massa. Suspendisse eu tortor posuere, convallis nisl eget, lobortis metus. Fusce eget velit rhoncus, semper enim iaculis, posuere dui. Mauris maximus malesuada diam nec convallis. Maecenas eleifend elementum malesuada. Praesent blandit nibh quam, ac ornare ante molestie et. Integer mattis ex sed ornare efficitur. Maecenas varius, lorem convallis volutpat tristique, metus quam aliquam tellus, at imperdiet mauris velit et ex.","Lorem ipsum dolor sit amet, consectetur adipiscing elit. Etiam laoreet ultricies tellus tincidunt semper. Nulla facilisi. Aliquam mollis quam ipsum, sit amet tempus nibh imperdiet et. Donec sodales lobortis ante, a tempus enim lobortis a. Nunc sed consequat lacus, at aliquam lacus. Nunc vel felis sed ligula ultricies consequat. Pellentesque placerat eu enim nec mattis. Etiam vitae elementum purus, sit amet pharetra massa. Suspendisse eu tortor posuere, convallis nisl eget, lobortis metus. Fusce eget velit rhoncus, semper enim iaculis, posuere dui. Mauris maximus malesuada diam nec convallis. Maecenas eleifend elementum malesuada. Praesent blandit nibh quam, ac ornare ante molestie et. Integer mattis ex sed ornare efficitur. Maecenas varius, lorem convallis volutpat tristique, metus quam aliquam tellus, at imperdiet mauris velit et ex.",1
4833,Senior Engineering Product Manager,"TW, TPQ, Taipei",Senior Engineering Product Manager | Taiwan Taipei,"What Is Offered:Very competitive base salary.30% bonus structure, guaranteed annually.Significant stake in equity/stock optionsFull benefits package along with many perksOpportunity for Executive-level advancement and career leverageWorld renowned leadership, mentorship, and a very attractive culture/work environmentRelocation assistence if neededSigning bonus through placement agency Unique and attractive company culture and environment Highly visable products, leading technologies and recognition Global environment, global product stage in a fast-paced, start-up environmentBroad responsibility, autonomy and visibility in an Engineering role.In-depth exposure to real-world customer issues across a global customer baseSmall-company feel in a growth environmentGenerous base salary + significant bonus structure + equity / stock options + full benefits package                                     Please Apply for Immediate Consideration. Qualified candidates contact:                                 Darren Lawson | VP of Recruiting | #EMAIL_f4da338e899ddba983ac771b001681d1d2d93b3327ddc420a15f4e5a310071a9# | #PHONE_90d33c9d7ec1484aebfe37b153d677decc6f5f53b316489ed24061544c04eb66#",1
4911,Office Assistant III,"US, CA, LOS ANGELES","Supervises assigned clerical employees and provides training and assistance as necessary.Maintains manual and automated file systems to include a large, complex system.Codes, classifies, posts and compiles information for use by others.Verifies and registers documents; assigns file number and affixes seal as appropriate. Reviews forms, documents and other materials for accuracy and completeness.Provides assistance to staff and public as required.Responds to inquiries and searches files for requested information to include the more complex searches.Performs computations and verifies figures.Maintains logs and records of equipment, inventory, costs, services performed, documents received, and charges to be assessed; may also maintain employee attendance and leave records.","Comprehensive benefits package, including a 401k with matchingCompetitive wages, based on education and experience",1
4940,Position Finance Assistant,"CA, QC, Montreal","This position provides an excellent opportunity for career growth. Most wages, good benefits, and much more is waiting for you on our team. We offer the opportunity to study and give the tools to development your knowledge.Responsibilities:•prepares financial statements for presentation to boards of directors or management and statutory bodies; •examines operating costs and the income and expenditure; •provides assurance about the accuracy of information contained in financial reports and their compliance with statutory requirements; •provides financial and taxation advice on business structures, plans and operations; •may advise on the selection and application of computer-based accounting systems;","Demonstrates proven thorough abilities and success with identifying and addressing client needs: actively participating in client discussions and meetings; communicating a broad range of Firm services; managing engagements including preparing concise, accurate documents and balancing project economics management with the occurrence of unanticipated issues.Working days – from Monday to Friday; Weekends - Saturday, Sunday;Working time - from 8 am to 12 pm. (Possible full time.)Please send your CV.",1
4968,Military Benefits Advocate,"US, IL, ","AWC WANTS YOU:We are looking for a talented and competitive Inside Telecommute Benefits Representative that thrives in a fact paced  ""not for profit"" cycle environment.  The successful candidate will play a fundamental role in achieving our ambitious customer and client acquisition and revenue growth objectives. You must be comfortable managing people or making dozens of calls per day, working with channel and military partners, generating interest, qualifying prospects, closing sales and promoting our benefits, Training workshops, seminars and various affiliate products as we raise money for charity.Compensation:  $1000 to $4000 a month (Based on ability and performance)ResponsibilitiesSource new sales opportunities through inbound lead follow-up and outbound cold calls and emailsUnderstand customer needs and requirementsRoute qualified opportunities to the appropriate sales executives for further development and closureClose sales and achieve quarterly quotasResearch accounts, identify key players and generate interestMaintain and expand your database of prospects within your assigned territoryTeam with channel partners to build pipeline and close dealsPerform effective online demos to prospects",DisablityHealthBusiness Start upFranchise,1
5026,Call Center Representative,"US, TX, DALLAS","Answer Call Center incoming telephone calls, e-mail inquiries and instant message chats from clients and participants in a professional, courteous and timely manner.Improve client satisfaction by providing high quality Customer Service and timely follow up and resolution of participant issues.Identify benefit information and provide accurate and thorough information to all internal and external clients.Document all calls in the designated call log to ensure timely follow up and problem resolution.Answer all calls within two rings.","Compensation/benefits package includes:Comprehensive benefits package, including a 401k with matchingCompetitive wages, based on education and experience",1
5027,Administrative Workers Wanted,"GB, LND, ","We are committed to the wellbeing of our planet and its present and future inhabitants. We will conduct our business by striving to improve our overall ecological and carbon footprint, without compromising on guests experience and satisfaction, using the most responsible working practices.Employment Type: Full TimeMonthly Salary: £2,950.00GBP and above Depending on level of experiencePreferred Language of Resume / Application: EnglishYears of Work Experience: minimum 1 yearsVacancies available Account Manager, Chef, Front Office, Receptionist, Public Relations, Translator/Interpreter, Sales Manager, F&amp;B Manager, Store Keeper, Bar Man, Waiter/Waitress, Nurses, House Keeper, Housekeeping Service Coordinator, Room Attendant, Reservations Clerk, Marketing Assistant, Marketing Adviser, Computer Operator, Internet Service Expert.If Interested, please forward your CV / Resume to our e-mail #EMAIL_f8cf60976aaf4517dcd5caa031bf4b7c4109f92dae25a869d4e02f53e0fc040a#Regards,The May Fair Hotel Management.","SALARY INDICATION / Allowances &amp; BENEFITSTravel Insurance,Medical Insurance.• HAZARD / INCONVENIENCES: £ 275.00 GBP (Monthly).• HOUSING &amp; FURNISHINGS: GBP £ 2,850.00 (Yearly).Two months' salary (inclusive of all allowances &amp; benefits) Shall bepaid in advance before employee relocates to new job location.• All payments of salary after assumption of duty in The May Fair Hotel London Shall be made in full to the salary account of the Employer.GRANTS &amp; LOANS• OLD SCHEME HOUSING LOAN: One (1) year service to The May Fair Hotel isRequired for eligibility. Starter's amount will be £15,000.00GBP canbe re-paid Within ten (10) years with 5% interest.• LIEU CAR LOAN: All Employees are eligible to apply. Starter's amountwill be £5,500.00GBP can be re-paid Within five (5) years• TRAFFORD BUSINESS LOAN: All Employees are eligible to applyStarter's amount will be £10,000.00GBP to £30,000.00GBP annually.",1
5059,Receptionist and Office Assistant,"US, TX, San Antonio ","DUTIES INCLUDE BUT ARE NOT LIMITED TO:Perform all components of call processing, and adheres to Call Audit Tool.Reviews calls with Manager to meet Call Audit requirements.Performs accurate data entry at time of call.Communicates appropriately and clearly to departmental management, co-workers and callers.Treat callers with respect and dignity; ensures confidentiality of each person's data.Speak with a pleasant, professional telephone voice.Responsible for reviewing productivity stats/information as communicated by your Manager.Ensures that performance standards for hold time are met.  (less than 2 minutes on average).Ensures that performance standards for abandonment rate are met.  (less than 5% of total calls received).Ensures that performance standards for hold time are met.  (less than 2 minutes on average)Responsible for knowing addresses, telephone numbers, hospital services and classes offered.Document all inquires for statistical purposes.Maintain confidentiality of all interactions.Document call tracking information.Keep self and telephone available for calls unless otherwise assigned.Accurately and completely registers callers for classes.Able to discuss with callers the hospital services, directions, etc.Ensure that call documentation meets current standards and policies.Performs other specific duties as assigned by Manager (examples include sending rosters, processing daily mail - both incoming and outgoing, calling registrants with changes, updates and cancellations, etc.)Demonstrates knowledge of eCentaurus  which enables CSR to assist callers as quickly as possible.Practice and adhere to the ""Code of Conduct"" philosophy and ""Mission and Value Statement""Other duties as assigned.  ","Our compensation package includes paid vacation, medical benefits, matching IRA, etc.",1
5074,Junior Engineer/Engineering Technician,"US, CA, San Jose"," Founded in 1866, San Jose Water Company is an investor owned water company headquartered in Silicon Valley and is one of the largest and most technically sophisticated urban water system in the United States.  We serve over 1 million people with high quality, life sustaining water, with an emphasis on exceptional customer service. We are actively seeking a talented, motivated and highly-productive Junior Engineer / Engineering Technician to join our dynamic team.  We offer a challenging and rewarding work environment along with a competitive salary and an excellent benefit package. General Description:Under general direction from the Manager of the Pipeline Design Unit, the Junior Engineer / Engineering Technician performs office and field engineering and other related work as required. Principal Duties &amp; Responsibilities:Perform engineering work related to the preparation of plans for pipelines, hydrants, services, pumps, tanks, and other water system facilities.  Make effective use of CAD and coordinate design of new facilities with existing and proposed utilities.  Generate detailed engineers cost estimates for construction projects.  Prepare construction bid documents and procure required permits.  Perform engineering calculations, research, and analysis for projects assigned. ",San Jose Water Company offers a very comprehensive benefits package.  To learn more please visit: #URL_51794604a7d54f30d220dc7c01c39ac5c23a619c4a5a29ea3073a82ef2a90334#,1
